aiter/configs/a8w8_tuned_gemm.csv
cu_num,M,N,K,kernelId,splitK,us,kernelName
80,1,1280,8192,34,0,21.6639,a8w8_rowwise_256x16x64x512_16x16_1x1_32x8x1_32x8x1_1x16x1x16_4x4x1_1x1_intrawave_v3
80,1,8192,1024,78,0,9.2458,a8w8_rowwise_64x16x16x128_16x16_1x1_8x8x1_8x8x1_1x16x1x4_4x4x1_1x1_interwave_v2
80,32,1280,8192,34,0,18.5951,a8w8_rowwise_256x16x64x512_16x16_1x1_32x8x1_32x8x1_1x16x1x16_4x4x1_1x1_intrawave_v3
80,32,8192,1024,28,0,10.4978,a8w8_rowwise_256x32x128x256_32x32_1x1_16x16x1_16x16x1_1x32x1x8_8x8x1_1x1_intrawave_v3
80,64,1280,8192,34,0,18.7283,a8w8_rowwise_256x16x64x512_16x16_1x1_32x8x1_32x8x1_1x16x1x16_4x4x1_1x1_intrawave_v3
80,64,8192,1024,21,0,13.2415,a8w8_rowwise_256x64x128x256_32x32_1x2_16x16x1_16x16x1_1x32x1x8_8x8x1_1x1_intrawave_v3
80,128,1280,8192,30,0,23.3627,a8w8_rowwise_256x32x64x512_16x16_1x2_32x8x1_32x8x1_1x32x1x8_8x8x1_1x2_intrawave_v3
80,128,8192,1024,45,0,20.3239,a8w8_rowwise_256x128x64x128_32x32_2x1_8x32x1_8x32x1_1x32x1x8_8x8x1_1x1_intrawave_v3
80,192,1280,8192,23,0,33.1804,a8w8_rowwise_256x64x64x512_32x32_1x1_32x8x1_32x8x1_1x32x1x8_8x8x1_1x1_intrawave_v3
80,192,8192,1024,47,0,26.4371,a8w8_rowwise_256x64x64x128_32x32_1x1_8x32x1_8x32x1_1x32x1x8_8x8x1_1x1_intrawave_v3
80,256,1280,8192,23,0,33.568,a8w8_rowwise_256x64x64x512_32x32_1x1_32x8x1_32x8x1_1x32x1x8_8x8x1_1x1_intrawave_v3
80,256,8192,1024,13,0,30.0043,a8w8_rowwise_256x128x128x128_32x32_2x2_8x32x1_8x32x1_1x32x1x8_8x8x1_1x1_intrawave_v3
80,320,1280,8192,21,0,54.7817,a8w8_rowwise_256x64x128x256_32x32_1x2_16x16x1_16x16x1_1x32x1x8_8x8x1_1x1_intrawave_v3
80,320,8192,1024,47,0,40.0412,a8w8_rowwise_256x64x64x128_32x32_1x1_8x32x1_8x32x1_1x32x1x8_8x8x1_1x1_intrawave_v3
80,512,1280,8192,21,0,55.3717,a8w8_rowwise_256x64x128x256_32x32_1x2_16x16x1_16x16x1_1x32x1x8_8x8x1_1x1_intrawave_v3
80,512,8192,1024,13,0,53.1344,a8w8_rowwise_256x128x128x128_32x32_2x2_8x32x1_8x32x1_1x32x1x8_8x8x1_1x1_intrawave_v3
80,1024,1280,8192,13,0,89.511,a8w8_rowwise_256x128x128x128_32x32_2x2_8x32x1_8x32x1_1x32x1x8_8x8x1_1x1_intrawave_v3
80,1024,8192,1024,13,0,94.821,a8w8_rowwise_256x128x128x128_32x32_2x2_8x32x1_8x32x1_1x32x1x8_8x8x1_1x1_intrawave_v3
80,2048,1280,8192,13,0,141.1901,a8w8_rowwise_256x128x128x128_32x32_2x2_8x32x1_8x32x1_1x32x1x8_8x8x1_1x1_intrawave_v3
80,2048,8192,1024,13,0,161.9182,a8w8_rowwise_256x128x128x128_32x32_2x2_8x32x1_8x32x1_1x32x1x8_8x8x1_1x1_intrawave_v3
80,4096,1280,8192,13,0,276.5091,a8w8_rowwise_256x128x128x128_32x32_2x2_8x32x1_8x32x1_1x32x1x8_8x8x1_1x1_intrawave_v3
80,4096,8192,1024,13,0,309.2924,a8w8_rowwise_256x128x128x128_32x32_2x2_8x32x1_8x32x1_1x32x1x8_8x8x1_1x1_intrawave_v3
80,8192,1280,8192,0,0,528.1318,a8w8_rowwise_256x256x256x64_32x32_4x4_4x64x1_4x64x1_1x32x1x8_8x8x1_1x1_intrawave_v4
80,8192,8192,1024,13,0,602.993,a8w8_rowwise_256x128x128x128_32x32_2x2_8x32x1_8x32x1_1x32x1x8_8x8x1_1x1_intrawave_v3
80,16384,1280,8192,0,0,1046.4171,a8w8_rowwise_256x256x256x64_32x32_4x4_4x64x1_4x64x1_1x32x1x8_8x8x1_1x1_intrawave_v4
80,16384,8192,1024,41,0,1210.4862,a8w8_rowwise_256x128x128x128_32x32_2x2_8x32x1_8x32x1_1x32x1x8_8x8x1_1x1_intrawave_v5
256,1,1280,8192,34,0,17.6914,a8w8_rowwise_256x16x64x512_16x16_1x1_32x8x1_32x8x1_1x16x1x16_4x4x1_1x1_intrawave_v3
256,16,1280,8192,34,0,15.0987,a8w8_rowwise_256x16x64x512_16x16_1x1_32x8x1_32x8x1_1x16x1x16_4x4x1_1x1_intrawave_v3
256,32,1280,8192,34,0,14.9955,a8w8_rowwise_256x16x64x512_16x16_1x1_32x8x1_32x8x1_1x16x1x16_4x4x1_1x1_intrawave_v3
256,64,1280,8192,34,0,14.7691,a8w8_rowwise_256x16x64x512_16x16_1x1_32x8x1_32x8x1_1x16x1x16_4x4x1_1x1_intrawave_v3
256,128,1280,8192,34,0,13.9827,a8w8_rowwise_256x16x64x512_16x16_1x1_32x8x1_32x8x1_1x16x1x16_4x4x1_1x1_intrawave_v3
256,256,1280,8192,30,0,16.2863,a8w8_rowwise_256x32x64x512_16x16_1x2_32x8x1_32x8x1_1x32x1x8_8x8x1_1x2_intrawave_v3
256,512,1280,8192,28,0,23.2059,a8w8_rowwise_256x32x128x256_32x32_1x1_16x16x1_16x16x1_1x32x1x8_8x8x1_1x1_intrawave_v3
256,1024,1280,8192,21,0,27.7294,a8w8_rowwise_256x64x128x256_32x32_1x2_16x16x1_16x16x1_1x32x1x8_8x8x1_1x1_intrawave_v3
256,2048,1280,8192,41,0,42.0169,a8w8_rowwise_256x128x128x128_32x32_2x2_8x32x1_8x32x1_1x32x1x8_8x8x1_1x1_intrawave_v5
256,4096,1280,8192,11,0,59.932,a8w8_rowwise_256x128x160x128_32x32_1x5_8x32x1_8x32x1_1x64x1x4_8x8x1_1x1_intrawave_v3
256,8192,1280,8192,4,0,95.3807,a8w8_rowwise_256x256x160x128_32x32_2x5_8x32x1_8x32x1_1x64x1x4_8x8x1_2x1_intrawave_v3
256,16384,1280,8192,4,0,178.1119,a8w8_rowwise_256x256x160x128_32x32_2x5_8x32x1_8x32x1_1x64x1x4_8x8x1_2x1_intrawave_v3
256,32768,1280,8192,1,0,339.8668,a8w8_rowwise_256x256x256x128_32x32_4x4_8x32x1_8x32x1_1x32x1x8_8x8x1_1x1_intrawave_v3
256,1,2560,8192,34,0,17.4658,a8w8_rowwise_256x16x64x512_16x16_1x1_32x8x1_32x8x1_1x16x1x16_4x4x1_1x1_intrawave_v3
256,16,2560,8192,34,0,14.8202,a8w8_rowwise_256x16x64x512_16x16_1x1_32x8x1_32x8x1_1x16x1x16_4x4x1_1x1_intrawave_v3
256,32,2560,8192,34,0,14.7991,a8w8_rowwise_256x16x64x512_16x16_1x1_32x8x1_32x8x1_1x16x1x16_4x4x1_1x1_intrawave_v3
256,64,2560,8192,34,0,14.5967,a8w8_rowwise_256x16x64x512_16x16_1x1_32x8x1_32x8x1_1x16x1x16_4x4x1_1x1_intrawave_v3
256,128,2560,8192,30,0,16.5177,a8w8_rowwise_256x32x64x512_16x16_1x2_32x8x1_32x8x1_1x32x1x8_8x8x1_1x2_intrawave_v3
256,256,2560,8192,28,0,23.112,a8w8_rowwise_256x32x128x256_32x32_1x1_16x16x1_16x16x1_1x32x1x8_8x8x1_1x1_intrawave_v3
256,512,2560,8192,21,0,27.6646,a8w8_rowwise_256x64x128x256_32x32_1x2_16x16x1_16x16x1_1x32x1x8_8x8x1_1x1_intrawave_v3
256,1024,2560,8192,41,0,42.1202,a8w8_rowwise_256x128x128x128_32x32_2x2_8x32x1_8x32x1_1x32x1x8_8x8x1_1x1_intrawave_v5
256,2048,2560,8192,11,0,61.0366,a8w8_rowwise_256x128x160x128_32x32_1x5_8x32x1_8x32x1_1x64x1x4_8x8x1_1x1_intrawave_v3
256,4096,2560,8192,4,0,90.7509,a8w8_rowwise_256x256x160x128_32x32_2x5_8x32x1_8x32x1_1x64x1x4_8x8x1_2x1_intrawave_v3
256,8192,2560,8192,4,0,173.6356,a8w8_rowwise_256x256x160x128_32x32_2x5_8x32x1_8x32x1_1x64x1x4_8x8x1_2x1_intrawave_v3
256,16384,2560,8192,1,0,329.1334,a8w8_rowwise_256x256x256x128_32x32_4x4_8x32x1_8x32x1_1x32x1x8_8x8x1_1x1_intrawave_v3
256,32768,2560,8192,1,0,599.612,a8w8_rowwise_256x256x256x128_32x32_4x4_8x32x1_8x32x1_1x32x1x8_8x8x1_1x1_intrawave_v3
256,1,10240,8192,34,0,20.5574,a8w8_rowwise_256x16x64x512_16x16_1x1_32x8x1_32x8x1_1x16x1x16_4x4x1_1x1_intrawave_v3
256,16,10240,8192,34,0,18.6072,a8w8_rowwise_256x16x64x512_16x16_1x1_32x8x1_32x8x1_1x16x1x16_4x4x1_1x1_intrawave_v3
256,32,10240,8192,30,0,20.8953,a8w8_rowwise_256x32x64x512_16x16_1x2_32x8x1_32x8x1_1x32x1x8_8x8x1_1x2_intrawave_v3
256,64,10240,8192,28,0,27.6213,a8w8_rowwise_256x32x128x256_32x32_1x1_16x16x1_16x16x1_1x32x1x8_8x8x1_1x1_intrawave_v3
256,128,10240,8192,15,0,31.2683,a8w8_rowwise_256x128x64x256_32x32_2x1_16x16x1_16x16x1_1x32x1x8_8x8x1_1x1_intrawave_v3
256,256,10240,8192,41,0,42.9954,a8w8_rowwise_256x128x128x128_32x32_2x2_8x32x1_8x32x1_1x32x1x8_8x8x1_1x1_intrawave_v5
256,512,10240,8192,11,0,61.9597,a8w8_rowwise_256x128x160x128_32x32_1x5_8x32x1_8x32x1_1x64x1x4_8x8x1_1x1_intrawave_v3
256,1024,10240,8192,4,0,89.391,a8w8_rowwise_256x256x160x128_32x32_2x5_8x32x1_8x32x1_1x64x1x4_8x8x1_2x1_intrawave_v3
256,2048,10240,8192,4,0,170.1034,a8w8_rowwise_256x256x160x128_32x32_2x5_8x32x1_8x32x1_1x64x1x4_8x8x1_2x1_intrawave_v3
256,4096,10240,8192,1,0,318.603,a8w8_rowwise_256x256x256x128_32x32_4x4_8x32x1_8x32x1_1x32x1x8_8x8x1_1x1_intrawave_v3
256,8192,10240,8192,1,0,575.9516,a8w8_rowwise_256x256x256x128_32x32_4x4_8x32x1_8x32x1_1x32x1x8_8x8x1_1x1_intrawave_v3
256,16384,10240,8192,1,0,1149.3883,a8w8_rowwise_256x256x256x128_32x32_4x4_8x32x1_8x32x1_1x32x1x8_8x8x1_1x1_intrawave_v3
256,32768,10240,8192,1,0,2299.333,a8w8_rowwise_256x256x256x128_32x32_4x4_8x32x1_8x32x1_1x32x1x8_8x8x1_1x1_intrawave_v3
256,1,8192,1024,79,0,5.7218,a8w8_rowwise_128x16x32x128_16x16_1x1_8x16x1_8x16x1_1x16x1x8_4x4x1_1x1_interwave_v2
256,16,8192,1024,79,0,5.4586,a8w8_rowwise_128x16x32x128_16x16_1x1_8x16x1_8x16x1_1x16x1x8_4x4x1_1x1_interwave_v2
256,32,8192,1024,79,0,5.6281,a8w8_rowwise_128x16x32x128_16x16_1x1_8x16x1_8x16x1_1x16x1x8_4x4x1_1x1_interwave_v2
256,64,192,1024,77,0,4.1582,a8w8_rowwise_64x16x16x64_16x16_1x1_4x16x1_4x16x1_1x16x1x4_4x4x1_1x1_interwave_v2
256,128,8192,1024,28,0,7.1186,a8w8_rowwise_256x32x128x256_32x32_1x1_16x16x1_16x16x1_1x32x1x8_8x8x1_1x1_intrawave_v3
256,256,8192,1024,21,0,8.6043,a8w8_rowwise_256x64x128x256_32x32_1x2_16x16x1_16x16x1_1x32x1x8_8x8x1_1x1_intrawave_v3
256,512,8192,1024,13,0,11.7749,a8w8_rowwise_256x128x128x128_32x32_2x2_8x32x1_8x32x1_1x32x1x8_8x8x1_1x1_intrawave_v3
256,1024,8192,1024,13,0,17.3848,a8w8_rowwise_256x128x128x128_32x32_2x2_8x32x1_8x32x1_1x32x1x8_8x8x1_1x1_intrawave_v3
256,2048,8192,1024,1,0,29.7892,a8w8_rowwise_256x256x256x128_32x32_4x4_8x32x1_8x32x1_1x32x1x8_8x8x1_1x1_intrawave_v3
256,4096,8192,1024,1,0,55.6305,a8w8_rowwise_256x256x256x128_32x32_4x4_8x32x1_8x32x1_1x32x1x8_8x8x1_1x1_intrawave_v3
256,8192,8192,1024,1,0,105.9654,a8w8_rowwise_256x256x256x128_32x32_4x4_8x32x1_8x32x1_1x32x1x8_8x8x1_1x1_intrawave_v3
256,16384,8192,1024,10,0,198.2601,a8w8_rowwise_256x128x192x128_32x32_2x3_8x32x1_8x32x1_1x32x1x8_8x8x1_1x1_intrawave_v3
256,32768,8192,1024,10,0,379.9256,a8w8_rowwise_256x128x192x128_32x32_2x3_8x32x1_8x32x1_1x32x1x8_8x8x1_1x1_intrawave_v3
256,1,8192,2048,34,0,7.1625,a8w8_rowwise_256x16x64x512_16x16_1x1_32x8x1_32x8x1_1x16x1x16_4x4x1_1x1_intrawave_v3
256,16,8192,2048,79,0,7.2552,a8w8_rowwise_128x16x32x128_16x16_1x1_8x16x1_8x16x1_1x16x1x8_4x4x1_1x1_interwave_v2
256,32,8192,2048,76,0,7.2889,a8w8_rowwise_128x32x16x128_16x16_1x1_8x16x1_8x16x1_1x16x1x8_2x2x1_1x1_interwave_v2
256,64,8192,2048,30,0,7.5798,a8w8_rowwise_256x32x64x512_16x16_1x2_32x8x1_32x8x1_1x32x1x8_8x8x1_1x2_intrawave_v3
256,128,8192,2048,23,0,10.2945,a8w8_rowwise_256x64x64x512_32x32_1x1_32x8x1_32x8x1_1x32x1x8_8x8x1_1x1_intrawave_v3
256,256,8192,2048,15,0,10.9387,a8w8_rowwise_256x128x64x256_32x32_2x1_16x16x1_16x16x1_1x32x1x8_8x8x1_1x1_intrawave_v3
256,512,8192,2048,41,0,16.8904,a8w8_rowwise_256x128x128x128_32x32_2x2_8x32x1_8x32x1_1x32x1x8_8x8x1_1x1_intrawave_v5
256,1024,8192,2048,41,0,27.2285,a8w8_rowwise_256x128x128x128_32x32_2x2_8x32x1_8x32x1_1x32x1x8_8x8x1_1x1_intrawave_v5
256,2048,8192,2048,1,0,42.7444,a8w8_rowwise_256x256x256x128_32x32_4x4_8x32x1_8x32x1_1x32x1x8_8x8x1_1x1_intrawave_v3
256,4096,8192,2048,1,0,83.0059,a8w8_rowwise_256x256x256x128_32x32_4x4_8x32x1_8x32x1_1x32x1x8_8x8x1_1x1_intrawave_v3
256,8192,8192,2048,1,0,159.9883,a8w8_rowwise_256x256x256x128_32x32_4x4_8x32x1_8x32x1_1x32x1x8_8x8x1_1x1_intrawave_v3
256,16384,8192,2048,1,0,299.7045,a8w8_rowwise_256x256x256x128_32x32_4x4_8x32x1_8x32x1_1x32x1x8_8x8x1_1x1_intrawave_v3
256,32768,8192,2048,1,0,594.1387,a8w8_rowwise_256x256x256x128_32x32_4x4_8x32x1_8x32x1_1x32x1x8_8x8x1_1x1_intrawave_v3
256,1,8192,8192,34,0,19.4709,a8w8_rowwise_256x16x64x512_16x16_1x1_32x8x1_32x8x1_1x16x1x16_4x4x1_1x1_intrawave_v3
256,16,8192,8192,34,0,17.2283,a8w8_rowwise_256x16x64x512_16x16_1x1_32x8x1_32x8x1_1x16x1x16_4x4x1_1x1_intrawave_v3
256,32,8192,8192,34,0,17.4586,a8w8_rowwise_256x16x64x512_16x16_1x1_32x8x1_32x8x1_1x16x1x16_4x4x1_1x1_intrawave_v3
256,64,8192,8192,30,0,19.4045,a8w8_rowwise_256x32x64x512_16x16_1x2_32x8x1_32x8x1_1x32x1x8_8x8x1_1x2_intrawave_v3
256,128,8192,8192,28,0,26.3513,a8w8_rowwise_256x32x128x256_32x32_1x1_16x16x1_16x16x1_1x32x1x8_8x8x1_1x1_intrawave_v3
256,256,8192,8192,15,0,31.6256,a8w8_rowwise_256x128x64x256_32x32_2x1_16x16x1_16x16x1_1x32x1x8_8x8x1_1x1_intrawave_v3
256,512,8192,8192,13,0,51.209,a8w8_rowwise_256x128x128x128_32x32_2x2_8x32x1_8x32x1_1x32x1x8_8x8x1_1x1_intrawave_v3
256,1024,8192,8192,13,0,88.9386,a8w8_rowwise_256x128x128x128_32x32_2x2_8x32x1_8x32x1_1x32x1x8_8x8x1_1x1_intrawave_v3
256,2048,8192,8192,1,0,125.3472,a8w8_rowwise_256x256x256x128_32x32_4x4_8x32x1_8x32x1_1x32x1x8_8x8x1_1x1_intrawave_v3
256,4096,8192,8192,1,0,240.0438,a8w8_rowwise_256x256x256x128_32x32_4x4_8x32x1_8x32x1_1x32x1x8_8x8x1_1x1_intrawave_v3
256,8192,8192,8192,1,0,469.2882,a8w8_rowwise_256x256x256x128_32x32_4x4_8x32x1_8x32x1_1x32x1x8_8x8x1_1x1_intrawave_v3
256,16384,8192,8192,1,0,933.9446,a8w8_rowwise_256x256x256x128_32x32_4x4_8x32x1_8x32x1_1x32x1x8_8x8x1_1x1_intrawave_v3
256,32768,8192,8192,1,0,1837.7153,a8w8_rowwise_256x256x256x128_32x32_4x4_8x32x1_8x32x1_1x32x1x8_8x8x1_1x1_intrawave_v3
256,1,7168,8192,34,0,19.015,a8w8_rowwise_256x16x64x512_16x16_1x1_32x8x1_32x8x1_1x16x1x16_4x4x1_1x1_intrawave_v3
256,16,7168,8192,34,0,16.6523,a8w8_rowwise_256x16x64x512_16x16_1x1_32x8x1_32x8x1_1x16x1x16_4x4x1_1x1_intrawave_v3
256,32,7168,8192,34,0,16.942,a8w8_rowwise_256x16x64x512_16x16_1x1_32x8x1_32x8x1_1x16x1x16_4x4x1_1x1_intrawave_v3
256,64,7168,8192,30,0,18.4286,a8w8_rowwise_256x32x64x512_16x16_1x2_32x8x1_32x8x1_1x32x1x8_8x8x1_1x2_intrawave_v3
256,128,7168,8192,28,0,26.0097,a8w8_rowwise_256x32x128x256_32x32_1x1_16x16x1_16x16x1_1x32x1x8_8x8x1_1x1_intrawave_v3
256,256,7168,8192,15,0,30.291,a8w8_rowwise_256x128x64x256_32x32_2x1_16x16x1_16x16x1_1x32x1x8_8x8x1_1x1_intrawave_v3
256,512,7168,8192,41,0,47.5197,a8w8_rowwise_256x128x128x128_32x32_2x2_8x32x1_8x32x1_1x32x1x8_8x8x1_1x1_intrawave_v5
256,1024,7168,8192,13,0,82.6278,a8w8_rowwise_256x128x128x128_32x32_2x2_8x32x1_8x32x1_1x32x1x8_8x8x1_1x1_intrawave_v3
256,2048,7168,8192,2,0,116.6871,a8w8_rowwise_256x256x224x128_32x32_2x7_8x32x1_8x32x1_1x64x1x4_8x8x1_2x1_intrawave_v3
256,4096,7168,8192,2,0,219.2844,a8w8_rowwise_256x256x224x128_32x32_2x7_8x32x1_8x32x1_1x64x1x4_8x8x1_2x1_intrawave_v3
256,8192,7168,8192,2,0,420.8889,a8w8_rowwise_256x256x224x128_32x32_2x7_8x32x1_8x32x1_1x64x1x4_8x8x1_2x1_intrawave_v3
256,16384,7168,8192,1,0,815.6995,a8w8_rowwise_256x256x256x128_32x32_4x4_8x32x1_8x32x1_1x32x1x8_8x8x1_1x1_intrawave_v3
256,32768,7168,8192,1,0,1620.6254,a8w8_rowwise_256x256x256x128_32x32_4x4_8x32x1_8x32x1_1x32x1x8_8x8x1_1x1_intrawave_v3
256,1,57344,8192,76,0,88.899,a8w8_rowwise_128x32x16x128_16x16_1x1_8x16x1_8x16x1_1x16x1x8_2x2x1_1x1_interwave_v2
256,16,57344,8192,80,0,90.9234,a8w8_rowwise_128x16x64x128_16x16_1x2_8x16x1_8x16x1_1x16x1x8_4x4x1_1x1_interwave_v2
256,32,57344,8192,81,0,93.0943,a8w8_rowwise_128x32x64x128_32x32_1x1_8x16x1_8x16x1_1x16x1x8_8x8x1_1x1_interwave_v2
256,64,57344,8192,46,0,99.6635,a8w8_rowwise_256x64x128x128_32x32_1x2_8x32x1_8x32x1_1x32x1x8_8x8x1_1x1_intrawave_v3
256,128,57344,8192,13,0,108.1045,a8w8_rowwise_256x128x128x128_32x32_2x2_8x32x1_8x32x1_1x32x1x8_8x8x1_1x1_intrawave_v3
256,256,57344,8192,2,0,135.372,a8w8_rowwise_256x256x224x128_32x32_2x7_8x32x1_8x32x1_1x64x1x4_8x8x1_2x1_intrawave_v3
256,512,57344,8192,2,0,233.9286,a8w8_rowwise_256x256x224x128_32x32_2x7_8x32x1_8x32x1_1x64x1x4_8x8x1_2x1_intrawave_v3
256,1024,57344,8192,2,0,438.8629,a8w8_rowwise_256x256x224x128_32x32_2x7_8x32x1_8x32x1_1x64x1x4_8x8x1_2x1_intrawave_v3
256,2048,57344,8192,1,0,814.7053,a8w8_rowwise_256x256x256x128_32x32_4x4_8x32x1_8x32x1_1x32x1x8_8x8x1_1x1_intrawave_v3
256,4096,57344,8192,1,0,1617.8989,a8w8_rowwise_256x256x256x128_32x32_4x4_8x32x1_8x32x1_1x32x1x8_8x8x1_1x1_intrawave_v3
256,8192,57344,8192,1,0,3164.0659,a8w8_rowwise_256x256x256x128_32x32_4x4_8x32x1_8x32x1_1x32x1x8_8x8x1_1x1_intrawave_v3
256,16384,57344,8192,1,0,6467.762,a8w8_rowwise_256x256x256x128_32x32_4x4_8x32x1_8x32x1_1x32x1x8_8x8x1_1x1_intrawave_v3
256,32768,57344,8192,1,0,12840.4952,a8w8_rowwise_256x256x256x128_32x32_4x4_8x32x1_8x32x1_1x32x1x8_8x8x1_1x1_intrawave_v3
256,1,8192,3584,34,0,11.2488,a8w8_rowwise_256x16x64x512_16x16_1x1_32x8x1_32x8x1_1x16x1x16_4x4x1_1x1_intrawave_v3
256,16,8192,3584,34,0,10.6477,a8w8_rowwise_256x16x64x512_16x16_1x1_32x8x1_32x8x1_1x16x1x16_4x4x1_1x1_intrawave_v3
256,32,8192,3584,34,0,9.4243,a8w8_rowwise_256x16x64x512_16x16_1x1_32x8x1_32x8x1_1x16x1x16_4x4x1_1x1_intrawave_v3
256,64,8192,3584,30,0,11.279,a8w8_rowwise_256x32x64x512_16x16_1x2_32x8x1_32x8x1_1x32x1x8_8x8x1_1x2_intrawave_v3
256,128,8192,3584,28,0,13.8708,a8w8_rowwise_256x32x128x256_32x32_1x1_16x16x1_16x16x1_1x32x1x8_8x8x1_1x1_intrawave_v3
256,256,8192,3584,15,0,16.5846,a8w8_rowwise_256x128x64x256_32x32_2x1_16x16x1_16x16x1_1x32x1x8_8x8x1_1x1_intrawave_v3
256,512,8192,3584,41,0,24.9561,a8w8_rowwise_256x128x128x128_32x32_2x2_8x32x1_8x32x1_1x32x1x8_8x8x1_1x1_intrawave_v5
256,1024,8192,3584,13,0,43.9928,a8w8_rowwise_256x128x128x128_32x32_2x2_8x32x1_8x32x1_1x32x1x8_8x8x1_1x1_intrawave_v3
256,2048,8192,3584,1,0,65.1518,a8w8_rowwise_256x256x256x128_32x32_4x4_8x32x1_8x32x1_1x32x1x8_8x8x1_1x1_intrawave_v3
256,4096,8192,3584,1,0,122.3648,a8w8_rowwise_256x256x256x128_32x32_4x4_8x32x1_8x32x1_1x32x1x8_8x8x1_1x1_intrawave_v3
256,8192,8192,3584,1,0,232.9396,a8w8_rowwise_256x256x256x128_32x32_4x4_8x32x1_8x32x1_1x32x1x8_8x8x1_1x1_intrawave_v3
256,16384,8192,3584,1,0,463.2471,a8w8_rowwise_256x256x256x128_32x32_4x4_8x32x1_8x32x1_1x32x1x8_8x8x1_1x1_intrawave_v3
256,32768,8192,3584,1,0,899.1908,a8w8_rowwise_256x256x256x128_32x32_4x4_8x32x1_8x32x1_1x32x1x8_8x8x1_1x1_intrawave_v3
256,1,8192,7168,34,0,16.9371,a8w8_rowwise_256x16x64x512_16x16_1x1_32x8x1_32x8x1_1x16x1x16_4x4x1_1x1_intrawave_v3
256,16,8192,7168,34,0,15.2131,a8w8_rowwise_256x16x64x512_16x16_1x1_32x8x1_32x8x1_1x16x1x16_4x4x1_1x1_intrawave_v3
256,32,8192,7168,34,0,16.2902,a8w8_rowwise_256x16x64x512_16x16_1x1_32x8x1_32x8x1_1x16x1x16_4x4x1_1x1_intrawave_v3
256,64,8192,7168,30,0,17.495,a8w8_rowwise_256x32x64x512_16x16_1x2_32x8x1_32x8x1_1x32x1x8_8x8x1_1x2_intrawave_v3
256,128,8192,7168,28,0,24.2653,a8w8_rowwise_256x32x128x256_32x32_1x1_16x16x1_16x16x1_1x32x1x8_8x8x1_1x1_intrawave_v3
256,256,8192,7168,21,0,29.138,a8w8_rowwise_256x64x128x256_32x32_1x2_16x16x1_16x16x1_1x32x1x8_8x8x1_1x1_intrawave_v3
256,512,8192,7168,41,0,44.168,a8w8_rowwise_256x128x128x128_32x32_2x2_8x32x1_8x32x1_1x32x1x8_8x8x1_1x1_intrawave_v5
256,1024,8192,7168,13,0,79.3336,a8w8_rowwise_256x128x128x128_32x32_2x2_8x32x1_8x32x1_1x32x1x8_8x8x1_1x1_intrawave_v3
256,2048,8192,7168,1,0,113.2102,a8w8_rowwise_256x256x256x128_32x32_4x4_8x32x1_8x32x1_1x32x1x8_8x8x1_1x1_intrawave_v3
256,4096,8192,7168,1,0,215.6239,a8w8_rowwise_256x256x256x128_32x32_4x4_8x32x1_8x32x1_1x32x1x8_8x8x1_1x1_intrawave_v3
256,8192,8192,7168,1,0,412.978,a8w8_rowwise_256x256x256x128_32x32_4x4_8x32x1_8x32x1_1x32x1x8_8x8x1_1x1_intrawave_v3
256,16384,8192,7168,1,0,819.3844,a8w8_rowwise_256x256x256x128_32x32_4x4_8x32x1_8x32x1_1x32x1x8_8x8x1_1x1_intrawave_v3
256,32768,8192,7168,1,0,1640.4404,a8w8_rowwise_256x256x256x128_32x32_4x4_8x32x1_8x32x1_1x32x1x8_8x8x1_1x1_intrawave_v3
256,1,8192,28672,34,0,59.8294,a8w8_rowwise_256x16x64x512_16x16_1x1_32x8x1_32x8x1_1x16x1x16_4x4x1_1x1_intrawave_v3
256,16,8192,28672,34,0,55.9502,a8w8_rowwise_256x16x64x512_16x16_1x1_32x8x1_32x8x1_1x16x1x16_4x4x1_1x1_intrawave_v3
256,32,8192,28672,34,0,54.7382,a8w8_rowwise_256x16x64x512_16x16_1x1_32x8x1_32x8x1_1x16x1x16_4x4x1_1x1_intrawave_v3
256,64,8192,28672,30,0,61.7622,a8w8_rowwise_256x32x64x512_16x16_1x2_32x8x1_32x8x1_1x32x1x8_8x8x1_1x2_intrawave_v3
256,128,8192,28672,28,0,87.5085,a8w8_rowwise_256x32x128x256_32x32_1x1_16x16x1_16x16x1_1x32x1x8_8x8x1_1x1_intrawave_v3
256,256,8192,28672,15,0,102.0397,a8w8_rowwise_256x128x64x256_32x32_2x1_16x16x1_16x16x1_1x32x1x8_8x8x1_1x1_intrawave_v3
256,512,8192,28672,41,0,150.8316,a8w8_rowwise_256x128x128x128_32x32_2x2_8x32x1_8x32x1_1x32x1x8_8x8x1_1x1_intrawave_v5
256,1024,8192,28672,41,0,274.6402,a8w8_rowwise_256x128x128x128_32x32_2x2_8x32x1_8x32x1_1x32x1x8_8x8x1_1x1_intrawave_v5
256,2048,8192,28672,1,0,387.0603,a8w8_rowwise_256x256x256x128_32x32_4x4_8x32x1_8x32x1_1x32x1x8_8x8x1_1x1_intrawave_v3
256,4096,8192,28672,1,0,764.1022,a8w8_rowwise_256x256x256x128_32x32_4x4_8x32x1_8x32x1_1x32x1x8_8x8x1_1x1_intrawave_v3
256,8192,8192,28672,1,0,1532.6908,a8w8_rowwise_256x256x256x128_32x32_4x4_8x32x1_8x32x1_1x32x1x8_8x8x1_1x1_intrawave_v3
256,16384,8192,28672,1,0,3088.0838,a8w8_rowwise_256x256x256x128_32x32_4x4_8x32x1_8x32x1_1x32x1x8_8x8x1_1x1_intrawave_v3
256,32768,8192,28672,1,0,6209.7387,a8w8_rowwise_256x256x256x128_32x32_4x4_8x32x1_8x32x1_1x32x1x8_8x8x1_1x1_intrawave_v3
256,1,2304,16384,34,0,28.7938,a8w8_rowwise_256x16x64x512_16x16_1x1_32x8x1_32x8x1_1x16x1x16_4x4x1_1x1_intrawave_v3
256,1,4608,16384,34,0,30.4899,a8w8_rowwise_256x16x64x512_16x16_1x1_32x8x1_32x8x1_1x16x1x16_4x4x1_1x1_intrawave_v3
256,1,9216,16384,34,0,34.1179,a8w8_rowwise_256x16x64x512_16x16_1x1_32x8x1_32x8x1_1x16x1x16_4x4x1_1x1_intrawave_v3
256,1,13312,16384,34,0,43.9839,a8w8_rowwise_256x16x64x512_16x16_1x1_32x8x1_32x8x1_1x16x1x16_4x4x1_1x1_intrawave_v3
256,1,16384,2048,34,0,8.2219,a8w8_rowwise_256x16x64x512_16x16_1x1_32x8x1_32x8x1_1x16x1x16_4x4x1_1x1_intrawave_v3
256,1,16384,4096,34,0,15.9093,a8w8_rowwise_256x16x64x512_16x16_1x1_32x8x1_32x8x1_1x16x1x16_4x4x1_1x1_intrawave_v3
256,1,16384,6656,34,0,22.3992,a8w8_rowwise_256x16x64x512_16x16_1x1_32x8x1_32x8x1_1x16x1x16_4x4x1_1x1_intrawave_v3
256,1,16384,8192,34,0,29.3945,a8w8_rowwise_256x16x64x512_16x16_1x1_32x8x1_32x8x1_1x16x1x16_4x4x1_1x1_intrawave_v3
256,1,16384,13312,34,0,39.0876,a8w8_rowwise_256x16x64x512_16x16_1x1_32x8x1_32x8x1_1x16x1x16_4x4x1_1x1_intrawave_v3
256,1,16384,26624,34,0,73.9812,a8w8_rowwise_256x16x64x512_16x16_1x1_32x8x1_32x8x1_1x16x1x16_4x4x1_1x1_intrawave_v3
256,1,26624,16384,34,0,88.2574,a8w8_rowwise_256x16x64x512_16x16_1x1_32x8x1_32x8x1_1x16x1x16_4x4x1_1x1_intrawave_v3
256,1,53248,16384,57,0,170.1222,a8w8_rowwise_128x32x16x128_16x16_1x1_8x16x1_8x16x1_1x16x1x8_2x2x1_1x1_intrawave_v2
256,16,2304,16384,34,0,23.498,a8w8_rowwise_256x16x64x512_16x16_1x1_32x8x1_32x8x1_1x16x1x16_4x4x1_1x1_intrawave_v3
256,16,4608,16384,34,0,25.7089,a8w8_rowwise_256x16x64x512_16x16_1x1_32x8x1_32x8x1_1x16x1x16_4x4x1_1x1_intrawave_v3
256,16,9216,16384,34,0,33.174,a8w8_rowwise_256x16x64x512_16x16_1x1_32x8x1_32x8x1_1x16x1x16_4x4x1_1x1_intrawave_v3
256,16,13312,16384,30,0,45.4589,a8w8_rowwise_256x32x64x512_16x16_1x2_32x8x1_32x8x1_1x32x1x8_8x8x1_1x2_intrawave_v3
256,16,16384,2048,34,0,8.2068,a8w8_rowwise_256x16x64x512_16x16_1x1_32x8x1_32x8x1_1x16x1x16_4x4x1_1x1_intrawave_v3
256,16,16384,4096,30,0,16.22,a8w8_rowwise_256x32x64x512_16x16_1x2_32x8x1_32x8x1_1x32x1x8_8x8x1_1x2_intrawave_v3
256,16,16384,6656,34,0,21.7401,a8w8_rowwise_256x16x64x512_16x16_1x1_32x8x1_32x8x1_1x16x1x16_4x4x1_1x1_intrawave_v3
256,16,16384,8192,30,0,29.6526,a8w8_rowwise_256x32x64x512_16x16_1x2_32x8x1_32x8x1_1x32x1x8_8x8x1_1x2_intrawave_v3
256,16,16384,13312,34,0,38.6763,a8w8_rowwise_256x16x64x512_16x16_1x1_32x8x1_32x8x1_1x16x1x16_4x4x1_1x1_intrawave_v3
256,16,16384,26624,34,0,73.7744,a8w8_rowwise_256x16x64x512_16x16_1x1_32x8x1_32x8x1_1x16x1x16_4x4x1_1x1_intrawave_v3
256,16,26624,16384,30,0,86.8898,a8w8_rowwise_256x32x64x512_16x16_1x2_32x8x1_32x8x1_1x32x1x8_8x8x1_1x2_intrawave_v3
256,16,53248,16384,34,0,180.7857,a8w8_rowwise_256x16x64x512_16x16_1x1_32x8x1_32x8x1_1x16x1x16_4x4x1_1x1_intrawave_v3
256,32,2304,16384,34,0,23.2436,a8w8_rowwise_256x16x64x512_16x16_1x1_32x8x1_32x8x1_1x16x1x16_4x4x1_1x1_intrawave_v3
256,32,4608,16384,34,0,24.957,a8w8_rowwise_256x16x64x512_16x16_1x1_32x8x1_32x8x1_1x16x1x16_4x4x1_1x1_intrawave_v3
256,32,9216,16384,30,0,34.6699,a8w8_rowwise_256x32x64x512_16x16_1x2_32x8x1_32x8x1_1x32x1x8_8x8x1_1x2_intrawave_v3
256,32,13312,16384,30,0,46.5921,a8w8_rowwise_256x32x64x512_16x16_1x2_32x8x1_32x8x1_1x32x1x8_8x8x1_1x2_intrawave_v3
256,32,16384,2048,30,0,10.4352,a8w8_rowwise_256x32x64x512_16x16_1x2_32x8x1_32x8x1_1x32x1x8_8x8x1_1x2_intrawave_v3
256,32,16384,4096,30,0,16.4693,a8w8_rowwise_256x32x64x512_16x16_1x2_32x8x1_32x8x1_1x32x1x8_8x8x1_1x2_intrawave_v3
256,32,16384,6656,30,0,22.4014,a8w8_rowwise_256x32x64x512_16x16_1x2_32x8x1_32x8x1_1x32x1x8_8x8x1_1x2_intrawave_v3
256,32,16384,8192,30,0,30.4324,a8w8_rowwise_256x32x64x512_16x16_1x2_32x8x1_32x8x1_1x32x1x8_8x8x1_1x2_intrawave_v3
256,32,16384,13312,30,0,39.8351,a8w8_rowwise_256x32x64x512_16x16_1x2_32x8x1_32x8x1_1x32x1x8_8x8x1_1x2_intrawave_v3
256,32,16384,26624,30,0,74.3742,a8w8_rowwise_256x32x64x512_16x16_1x2_32x8x1_32x8x1_1x32x1x8_8x8x1_1x2_intrawave_v3
256,32,26624,16384,30,0,89.3239,a8w8_rowwise_256x32x64x512_16x16_1x2_32x8x1_32x8x1_1x32x1x8_8x8x1_1x2_intrawave_v3
256,32,53248,16384,34,0,168.8762,a8w8_rowwise_256x16x64x512_16x16_1x1_32x8x1_32x8x1_1x16x1x16_4x4x1_1x1_intrawave_v3
256,64,2304,16384,34,0,23.2558,a8w8_rowwise_256x16x64x512_16x16_1x1_32x8x1_32x8x1_1x16x1x16_4x4x1_1x1_intrawave_v3
256,64,4608,16384,30,0,27.9735,a8w8_rowwise_256x32x64x512_16x16_1x2_32x8x1_32x8x1_1x32x1x8_8x8x1_1x2_intrawave_v3
256,64,9216,16384,23,0,41.0647,a8w8_rowwise_256x64x64x512_32x32_1x1_32x8x1_32x8x1_1x32x1x8_8x8x1_1x1_intrawave_v3
256,64,13312,16384,23,0,50.0251,a8w8_rowwise_256x64x64x512_32x32_1x1_32x8x1_32x8x1_1x32x1x8_8x8x1_1x1_intrawave_v3
256,64,16384,2048,23,0,11.4046,a8w8_rowwise_256x64x64x512_32x32_1x1_32x8x1_32x8x1_1x32x1x8_8x8x1_1x1_intrawave_v3
256,64,16384,4096,23,0,19.0989,a8w8_rowwise_256x64x64x512_32x32_1x1_32x8x1_32x8x1_1x32x1x8_8x8x1_1x1_intrawave_v3
256,64,16384,6656,23,0,26.4384,a8w8_rowwise_256x64x64x512_32x32_1x1_32x8x1_32x8x1_1x32x1x8_8x8x1_1x1_intrawave_v3
256,64,16384,8192,23,0,33.8597,a8w8_rowwise_256x64x64x512_32x32_1x1_32x8x1_32x8x1_1x32x1x8_8x8x1_1x1_intrawave_v3
256,64,16384,13312,23,0,46.8247,a8w8_rowwise_256x64x64x512_32x32_1x1_32x8x1_32x8x1_1x32x1x8_8x8x1_1x1_intrawave_v3
256,64,16384,26624,23,0,89.8884,a8w8_rowwise_256x64x64x512_32x32_1x1_32x8x1_32x8x1_1x32x1x8_8x8x1_1x1_intrawave_v3
256,64,26624,16384,23,0,91.2922,a8w8_rowwise_256x64x64x512_32x32_1x1_32x8x1_32x8x1_1x32x1x8_8x8x1_1x1_intrawave_v3
256,64,53248,16384,23,0,184.3385,a8w8_rowwise_256x64x64x512_32x32_1x1_32x8x1_32x8x1_1x32x1x8_8x8x1_1x1_intrawave_v3
256,128,2304,16384,30,0,26.5035,a8w8_rowwise_256x32x64x512_16x16_1x2_32x8x1_32x8x1_1x32x1x8_8x8x1_1x2_intrawave_v3
256,128,4608,16384,23,0,33.4047,a8w8_rowwise_256x64x64x512_32x32_1x1_32x8x1_32x8x1_1x32x1x8_8x8x1_1x1_intrawave_v3
256,128,9216,16384,23,0,59.454,a8w8_rowwise_256x64x64x512_32x32_1x1_32x8x1_32x8x1_1x32x1x8_8x8x1_1x1_intrawave_v3
256,128,13312,16384,23,0,65.9651,a8w8_rowwise_256x64x64x512_32x32_1x1_32x8x1_32x8x1_1x32x1x8_8x8x1_1x1_intrawave_v3
256,128,16384,2048,23,0,14.5668,a8w8_rowwise_256x64x64x512_32x32_1x1_32x8x1_32x8x1_1x32x1x8_8x8x1_1x1_intrawave_v3
256,128,16384,4096,23,0,23.3525,a8w8_rowwise_256x64x64x512_32x32_1x1_32x8x1_32x8x1_1x32x1x8_8x8x1_1x1_intrawave_v3
256,128,16384,6656,23,0,34.0329,a8w8_rowwise_256x64x64x512_32x32_1x1_32x8x1_32x8x1_1x32x1x8_8x8x1_1x1_intrawave_v3
256,128,16384,8192,23,0,45.1385,a8w8_rowwise_256x64x64x512_32x32_1x1_32x8x1_32x8x1_1x32x1x8_8x8x1_1x1_intrawave_v3
256,128,16384,13312,23,0,61.6432,a8w8_rowwise_256x64x64x512_32x32_1x1_32x8x1_32x8x1_1x32x1x8_8x8x1_1x1_intrawave_v3
256,128,16384,26624,23,0,118.3409,a8w8_rowwise_256x64x64x512_32x32_1x1_32x8x1_32x8x1_1x32x1x8_8x8x1_1x1_intrawave_v3
256,128,26624,16384,23,0,129.1529,a8w8_rowwise_256x64x64x512_32x32_1x1_32x8x1_32x8x1_1x32x1x8_8x8x1_1x1_intrawave_v3
256,128,53248,16384,23,0,230.1893,a8w8_rowwise_256x64x64x512_32x32_1x1_32x8x1_32x8x1_1x32x1x8_8x8x1_1x1_intrawave_v3
256,256,2304,16384,23,0,32.4817,a8w8_rowwise_256x64x64x512_32x32_1x1_32x8x1_32x8x1_1x32x1x8_8x8x1_1x1_intrawave_v3
256,256,4608,16384,23,0,55.0189,a8w8_rowwise_256x64x64x512_32x32_1x1_32x8x1_32x8x1_1x32x1x8_8x8x1_1x1_intrawave_v3
256,256,9216,16384,23,0,86.8248,a8w8_rowwise_256x64x64x512_32x32_1x1_32x8x1_32x8x1_1x32x1x8_8x8x1_1x1_intrawave_v3
256,256,13312,16384,23,0,113.4219,a8w8_rowwise_256x64x64x512_32x32_1x1_32x8x1_32x8x1_1x32x1x8_8x8x1_1x1_intrawave_v3
256,256,16384,2048,15,0,22.0982,a8w8_rowwise_256x128x64x256_32x32_2x1_16x16x1_16x16x1_1x32x1x8_8x8x1_1x1_intrawave_v3
256,256,16384,4096,15,0,39.8495,a8w8_rowwise_256x128x64x256_32x32_2x1_16x16x1_16x16x1_1x32x1x8_8x8x1_1x1_intrawave_v3
256,256,16384,6656,23,0,57.6756,a8w8_rowwise_256x64x64x512_32x32_1x1_32x8x1_32x8x1_1x32x1x8_8x8x1_1x1_intrawave_v3
256,256,16384,8192,15,0,72.9104,a8w8_rowwise_256x128x64x256_32x32_2x1_16x16x1_16x16x1_1x32x1x8_8x8x1_1x1_intrawave_v3
256,256,16384,13312,23,0,106.2833,a8w8_rowwise_256x64x64x512_32x32_1x1_32x8x1_32x8x1_1x32x1x8_8x8x1_1x1_intrawave_v3
256,256,16384,26624,23,0,202.2465,a8w8_rowwise_256x64x64x512_32x32_1x1_32x8x1_32x8x1_1x32x1x8_8x8x1_1x1_intrawave_v3
256,256,26624,16384,23,0,206.2403,a8w8_rowwise_256x64x64x512_32x32_1x1_32x8x1_32x8x1_1x32x1x8_8x8x1_1x1_intrawave_v3
256,256,53248,16384,40,0,368.0253,a8w8_rowwise_256x256x224x128_16x16_8x7_8x32x1_8x32x1_1x64x1x4_8x8x1_2x1_intrawave_v3
256,512,2304,16384,23,0,54.2058,a8w8_rowwise_256x64x64x512_32x32_1x1_32x8x1_32x8x1_1x32x1x8_8x8x1_1x1_intrawave_v3
256,512,4608,16384,23,0,87.1647,a8w8_rowwise_256x64x64x512_32x32_1x1_32x8x1_32x8x1_1x32x1x8_8x8x1_1x1_intrawave_v3
256,512,9216,16384,23,0,141.9471,a8w8_rowwise_256x64x64x512_32x32_1x1_32x8x1_32x8x1_1x32x1x8_8x8x1_1x1_intrawave_v3
256,512,13312,16384,23,0,199.0315,a8w8_rowwise_256x64x64x512_32x32_1x1_32x8x1_32x8x1_1x32x1x8_8x8x1_1x1_intrawave_v3
256,512,16384,2048,15,0,38.4305,a8w8_rowwise_256x128x64x256_32x32_2x1_16x16x1_16x16x1_1x32x1x8_8x8x1_1x1_intrawave_v3
256,512,16384,4096,15,0,65.4454,a8w8_rowwise_256x128x64x256_32x32_2x1_16x16x1_16x16x1_1x32x1x8_8x8x1_1x1_intrawave_v3
256,512,16384,6656,15,0,102.3241,a8w8_rowwise_256x128x64x256_32x32_2x1_16x16x1_16x16x1_1x32x1x8_8x8x1_1x1_intrawave_v3
256,512,16384,8192,15,0,123.6929,a8w8_rowwise_256x128x64x256_32x32_2x1_16x16x1_16x16x1_1x32x1x8_8x8x1_1x1_intrawave_v3
256,512,16384,13312,15,0,191.2442,a8w8_rowwise_256x128x64x256_32x32_2x1_16x16x1_16x16x1_1x32x1x8_8x8x1_1x1_intrawave_v3
256,512,16384,26624,15,0,365.7012,a8w8_rowwise_256x128x64x256_32x32_2x1_16x16x1_16x16x1_1x32x1x8_8x8x1_1x1_intrawave_v3
256,512,26624,16384,15,0,349.3418,a8w8_rowwise_256x128x64x256_32x32_2x1_16x16x1_16x16x1_1x32x1x8_8x8x1_1x1_intrawave_v3
256,512,53248,16384,15,0,651.6344,a8w8_rowwise_256x128x64x256_32x32_2x1_16x16x1_16x16x1_1x32x1x8_8x8x1_1x1_intrawave_v3
256,1024,2304,16384,23,0,86.7135,a8w8_rowwise_256x64x64x512_32x32_1x1_32x8x1_32x8x1_1x32x1x8_8x8x1_1x1_intrawave_v3
256,1024,4608,16384,23,0,143.2677,a8w8_rowwise_256x64x64x512_32x32_1x1_32x8x1_32x8x1_1x32x1x8_8x8x1_1x1_intrawave_v3
256,1024,9216,16384,15,0,243.9282,a8w8_rowwise_256x128x64x256_32x32_2x1_16x16x1_16x16x1_1x32x1x8_8x8x1_1x1_intrawave_v3
256,1024,13312,16384,40,0,306.5211,a8w8_rowwise_256x256x224x128_16x16_8x7_8x32x1_8x32x1_1x64x1x4_8x8x1_2x1_intrawave_v3
256,1024,16384,2048,1,0,61.8687,a8w8_rowwise_256x256x256x128_32x32_4x4_8x32x1_8x32x1_1x32x1x8_8x8x1_1x1_intrawave_v3
256,1024,16384,4096,1,0,108.4683,a8w8_rowwise_256x256x256x128_32x32_4x4_8x32x1_8x32x1_1x32x1x8_8x8x1_1x1_intrawave_v3
256,1024,16384,6656,1,0,165.4754,a8w8_rowwise_256x256x256x128_32x32_4x4_8x32x1_8x32x1_1x32x1x8_8x8x1_1x1_intrawave_v3
256,1024,16384,8192,1,0,202.2384,a8w8_rowwise_256x256x256x128_32x32_4x4_8x32x1_8x32x1_1x32x1x8_8x8x1_1x1_intrawave_v3
256,1024,16384,13312,1,0,307.7016,a8w8_rowwise_256x256x256x128_32x32_4x4_8x32x1_8x32x1_1x32x1x8_8x8x1_1x1_intrawave_v3
256,1024,16384,26624,1,0,603.8507,a8w8_rowwise_256x256x256x128_32x32_4x4_8x32x1_8x32x1_1x32x1x8_8x8x1_1x1_intrawave_v3
256,1024,26624,16384,15,0,630.2527,a8w8_rowwise_256x128x64x256_32x32_2x1_16x16x1_16x16x1_1x32x1x8_8x8x1_1x1_intrawave_v3
256,1024,53248,16384,40,0,1195.3563,a8w8_rowwise_256x256x224x128_16x16_8x7_8x32x1_8x32x1_1x64x1x4_8x8x1_2x1_intrawave_v3
256,2048,2304,16384,23,0,145.2155,a8w8_rowwise_256x64x64x512_32x32_1x1_32x8x1_32x8x1_1x32x1x8_8x8x1_1x1_intrawave_v3
256,2048,4608,16384,11,0,247.0665,a8w8_rowwise_256x128x160x128_32x32_1x5_8x32x1_8x32x1_1x64x1x4_8x8x1_1x1_intrawave_v3
256,2048,9216,16384,15,0,431.0243,a8w8_rowwise_256x128x64x256_32x32_2x1_16x16x1_16x16x1_1x32x1x8_8x8x1_1x1_intrawave_v3
256,2048,13312,16384,40,0,609.7983,a8w8_rowwise_256x256x224x128_16x16_8x7_8x32x1_8x32x1_1x64x1x4_8x8x1_2x1_intrawave_v3
256,2048,16384,2048,1,0,109.435,a8w8_rowwise_256x256x256x128_32x32_4x4_8x32x1_8x32x1_1x32x1x8_8x8x1_1x1_intrawave_v3
256,2048,16384,4096,1,0,192.1657,a8w8_rowwise_256x256x256x128_32x32_4x4_8x32x1_8x32x1_1x32x1x8_8x8x1_1x1_intrawave_v3
256,2048,16384,6656,1,0,297.4271,a8w8_rowwise_256x256x256x128_32x32_4x4_8x32x1_8x32x1_1x32x1x8_8x8x1_1x1_intrawave_v3
256,2048,16384,8192,1,0,351.3779,a8w8_rowwise_256x256x256x128_32x32_4x4_8x32x1_8x32x1_1x32x1x8_8x8x1_1x1_intrawave_v3
256,2048,16384,13312,1,0,562.4285,a8w8_rowwise_256x256x256x128_32x32_4x4_8x32x1_8x32x1_1x32x1x8_8x8x1_1x1_intrawave_v3
256,2048,16384,26624,1,0,1159.8861,a8w8_rowwise_256x256x256x128_32x32_4x4_8x32x1_8x32x1_1x32x1x8_8x8x1_1x1_intrawave_v3
256,2048,26624,16384,40,0,1145.701,a8w8_rowwise_256x256x224x128_16x16_8x7_8x32x1_8x32x1_1x64x1x4_8x8x1_2x1_intrawave_v3
256,2048,53248,16384,1,0,2196.6099,a8w8_rowwise_256x256x256x128_32x32_4x4_8x32x1_8x32x1_1x32x1x8_8x8x1_1x1_intrawave_v3
256,4096,2304,16384,11,0,246.424,a8w8_rowwise_256x128x160x128_32x32_1x5_8x32x1_8x32x1_1x64x1x4_8x8x1_1x1_intrawave_v3
256,4096,4608,16384,15,0,433.3975,a8w8_rowwise_256x128x64x256_32x32_2x1_16x16x1_16x16x1_1x32x1x8_8x8x1_1x1_intrawave_v3
256,4096,9216,16384,39,0,778.6417,a8w8_rowwise_256x224x256x128_16x16_7x8_8x32x1_8x32x1_1x32x1x8_8x8x1_1x2_intrawave_v3
256,4096,13312,16384,10,0,1114.1158,a8w8_rowwise_256x128x192x128_32x32_2x3_8x32x1_8x32x1_1x32x1x8_8x8x1_1x1_intrawave_v3
256,4096,16384,2048,1,0,205.0841,a8w8_rowwise_256x256x256x128_32x32_4x4_8x32x1_8x32x1_1x32x1x8_8x8x1_1x1_intrawave_v3
256,4096,16384,4096,39,0,353.73,a8w8_rowwise_256x224x256x128_16x16_7x8_8x32x1_8x32x1_1x32x1x8_8x8x1_1x2_intrawave_v3
256,4096,16384,6656,39,0,561.0198,a8w8_rowwise_256x224x256x128_16x16_7x8_8x32x1_8x32x1_1x32x1x8_8x8x1_1x2_intrawave_v3
256,4096,16384,8192,39,0,657.0519,a8w8_rowwise_256x224x256x128_16x16_7x8_8x32x1_8x32x1_1x32x1x8_8x8x1_1x2_intrawave_v3
256,4096,16384,13312,1,0,1080.1678,a8w8_rowwise_256x256x256x128_32x32_4x4_8x32x1_8x32x1_1x32x1x8_8x8x1_1x1_intrawave_v3
256,4096,16384,26624,1,0,2197.8702,a8w8_rowwise_256x256x256x128_32x32_4x4_8x32x1_8x32x1_1x32x1x8_8x8x1_1x1_intrawave_v3
256,4096,26624,16384,10,0,2199.7579,a8w8_rowwise_256x128x192x128_32x32_2x3_8x32x1_8x32x1_1x32x1x8_8x8x1_1x1_intrawave_v3
256,4096,53248,16384,1,0,4075.2597,a8w8_rowwise_256x256x256x128_32x32_4x4_8x32x1_8x32x1_1x32x1x8_8x8x1_1x1_intrawave_v3
256,8192,2304,16384,15,0,463.8213,a8w8_rowwise_256x128x64x256_32x32_2x1_16x16x1_16x16x1_1x32x1x8_8x8x1_1x1_intrawave_v3
256,8192,4608,16384,39,0,844.5637,a8w8_rowwise_256x224x256x128_16x16_7x8_8x32x1_8x32x1_1x32x1x8_8x8x1_1x2_intrawave_v3
256,8192,9216,16384,43,0,1557.3892,a8w8_rowwise_256x256x128x64_32x32_4x2_4x64x1_4x64x1_1x32x1x8_8x8x1_1x1_interwave_v1
256,8192,13312,16384,40,0,2189.1084,a8w8_rowwise_256x256x224x128_16x16_8x7_8x32x1_8x32x1_1x64x1x4_8x8x1_2x1_intrawave_v3
256,8192,16384,2048,39,0,392.4492,a8w8_rowwise_256x224x256x128_16x16_7x8_8x32x1_8x32x1_1x32x1x8_8x8x1_1x2_intrawave_v3
256,8192,16384,4096,39,0,678.4652,a8w8_rowwise_256x224x256x128_16x16_7x8_8x32x1_8x32x1_1x32x1x8_8x8x1_1x2_intrawave_v3
256,8192,16384,6656,39,0,1094.0621,a8w8_rowwise_256x224x256x128_16x16_7x8_8x32x1_8x32x1_1x32x1x8_8x8x1_1x2_intrawave_v3
256,8192,16384,8192,1,0,1288.1354,a8w8_rowwise_256x256x256x128_32x32_4x4_8x32x1_8x32x1_1x32x1x8_8x8x1_1x1_intrawave_v3
256,8192,16384,13312,1,0,2091.5748,a8w8_rowwise_256x256x256x128_32x32_4x4_8x32x1_8x32x1_1x32x1x8_8x8x1_1x1_intrawave_v3
256,8192,16384,26624,1,0,4736.0103,a8w8_rowwise_256x256x256x128_32x32_4x4_8x32x1_8x32x1_1x32x1x8_8x8x1_1x1_intrawave_v3
256,8192,26624,16384,40,0,4074.1172,a8w8_rowwise_256x256x224x128_16x16_8x7_8x32x1_8x32x1_1x64x1x4_8x8x1_2x1_intrawave_v3
256,8192,53248,16384,40,0,8028.0784,a8w8_rowwise_256x256x224x128_16x16_8x7_8x32x1_8x32x1_1x64x1x4_8x8x1_2x1_intrawave_v3
256,16384,2304,16384,15,0,878.7062,a8w8_rowwise_256x128x64x256_32x32_2x1_16x16x1_16x16x1_1x32x1x8_8x8x1_1x1_intrawave_v3
256,16384,4608,16384,40,0,1632.4516,a8w8_rowwise_256x256x224x128_16x16_8x7_8x32x1_8x32x1_1x64x1x4_8x8x1_2x1_intrawave_v3
256,16384,9216,16384,1,0,2949.0967,a8w8_rowwise_256x256x256x128_32x32_4x4_8x32x1_8x32x1_1x32x1x8_8x8x1_1x1_intrawave_v3
256,16384,13312,16384,1,0,4134.6494,a8w8_rowwise_256x256x256x128_32x32_4x4_8x32x1_8x32x1_1x32x1x8_8x8x1_1x1_intrawave_v3
256,16384,16384,2048,1,0,719.1952,a8w8_rowwise_256x256x256x128_32x32_4x4_8x32x1_8x32x1_1x32x1x8_8x8x1_1x1_intrawave_v3
256,16384,16384,4096,39,0,1327.6342,a8w8_rowwise_256x224x256x128_16x16_7x8_8x32x1_8x32x1_1x32x1x8_8x8x1_1x2_intrawave_v3
256,16384,16384,6656,39,0,2120.7951,a8w8_rowwise_256x224x256x128_16x16_7x8_8x32x1_8x32x1_1x32x1x8_8x8x1_1x2_intrawave_v3
256,16384,16384,8192,1,0,2555.2385,a8w8_rowwise_256x256x256x128_32x32_4x4_8x32x1_8x32x1_1x32x1x8_8x8x1_1x1_intrawave_v3
256,16384,16384,13312,1,0,4157.4955,a8w8_rowwise_256x256x256x128_32x32_4x4_8x32x1_8x32x1_1x32x1x8_8x8x1_1x1_intrawave_v3
256,16384,16384,26624,1,0,9368.503,a8w8_rowwise_256x256x256x128_32x32_4x4_8x32x1_8x32x1_1x32x1x8_8x8x1_1x1_intrawave_v3
256,16384,26624,16384,40,0,8090.2903,a8w8_rowwise_256x256x224x128_16x16_8x7_8x32x1_8x32x1_1x64x1x4_8x8x1_2x1_intrawave_v3
256,16384,53248,16384,40,0,15996.8357,a8w8_rowwise_256x256x224x128_16x16_8x7_8x32x1_8x32x1_1x64x1x4_8x8x1_2x1_intrawave_v3
256,32768,2304,16384,1,0,1717.9546,a8w8_rowwise_256x256x256x128_32x32_4x4_8x32x1_8x32x1_1x32x1x8_8x8x1_1x1_intrawave_v3
256,32768,4608,16384,40,0,3026.9648,a8w8_rowwise_256x256x224x128_16x16_8x7_8x32x1_8x32x1_1x64x1x4_8x8x1_2x1_intrawave_v3
256,32768,9216,16384,1,0,5884.19,a8w8_rowwise_256x256x256x128_32x32_4x4_8x32x1_8x32x1_1x32x1x8_8x8x1_1x1_intrawave_v3
256,32768,13312,16384,40,0,8230.5195,a8w8_rowwise_256x256x224x128_16x16_8x7_8x32x1_8x32x1_1x64x1x4_8x8x1_2x1_intrawave_v3
256,32768,16384,2048,1,0,1409.7173,a8w8_rowwise_256x256x256x128_32x32_4x4_8x32x1_8x32x1_1x32x1x8_8x8x1_1x1_intrawave_v3
256,32768,16384,4096,39,0,2546.0869,a8w8_rowwise_256x224x256x128_16x16_7x8_8x32x1_8x32x1_1x32x1x8_8x8x1_1x2_intrawave_v3
256,32768,16384,6656,39,0,4073.3594,a8w8_rowwise_256x224x256x128_16x16_7x8_8x32x1_8x32x1_1x32x1x8_8x8x1_1x2_intrawave_v3
256,32768,16384,8192,39,0,4965.434,a8w8_rowwise_256x224x256x128_16x16_7x8_8x32x1_8x32x1_1x32x1x8_8x8x1_1x2_intrawave_v3
256,32768,16384,13312,1,0,8271.2663,a8w8_rowwise_256x256x256x128_32x32_4x4_8x32x1_8x32x1_1x32x1x8_8x8x1_1x1_intrawave_v3
256,32768,16384,26624,1,0,19064.3766,a8w8_rowwise_256x256x256x128_32x32_4x4_8x32x1_8x32x1_1x32x1x8_8x8x1_1x1_intrawave_v3
256,32768,26624,16384,40,0,16029.2644,a8w8_rowwise_256x256x224x128_16x16_8x7_8x32x1_8x32x1_1x64x1x4_8x8x1_2x1_intrawave_v3
256,32768,53248,16384,40,0,31823.1958,a8w8_rowwise_256x256x224x128_16x16_8x7_8x32x1_8x32x1_1x64x1x4_8x8x1_2x1_intrawave_v3
256,1,100,5120,34,0,8.7502,a8w8_rowwise_256x16x64x512_16x16_1x1_32x8x1_32x8x1_1x16x1x16_4x4x1_1x1_intrawave_v3
256,1,200,5120,34,0,9.0193,a8w8_rowwise_256x16x64x512_16x16_1x1_32x8x1_32x8x1_1x16x1x16_4x4x1_1x1_intrawave_v3
256,1,800,5120,34,0,11.5471,a8w8_rowwise_256x16x64x512_16x16_1x1_32x8x1_32x8x1_1x16x1x16_4x4x1_1x1_intrawave_v3
256,1,5120,640,79,0,4.3227,a8w8_rowwise_128x16x32x128_16x16_1x1_8x16x1_8x16x1_1x16x1x8_4x4x1_1x1_interwave_v2
256,1,5120,1280,34,0,6.1049,a8w8_rowwise_256x16x64x512_16x16_1x1_32x8x1_32x8x1_1x16x1x16_4x4x1_1x1_intrawave_v3
256,1,5120,3200,30,0,9.8138,a8w8_rowwise_256x32x64x512_16x16_1x2_32x8x1_32x8x1_1x32x1x8_8x8x1_1x2_intrawave_v3
256,1,5120,5120,34,0,12.3186,a8w8_rowwise_256x16x64x512_16x16_1x1_32x8x1_32x8x1_1x16x1x16_4x4x1_1x1_intrawave_v3
256,1,5120,6400,34,0,14.5779,a8w8_rowwise_256x16x64x512_16x16_1x1_32x8x1_32x8x1_1x16x1x16_4x4x1_1x1_intrawave_v3
256,1,5120,25600,23,0,47.1407,a8w8_rowwise_256x64x64x512_32x32_1x1_32x8x1_32x8x1_1x32x1x8_8x8x1_1x1_intrawave_v3
256,1,6400,5120,34,0,12.7506,a8w8_rowwise_256x16x64x512_16x16_1x1_32x8x1_32x8x1_1x16x1x16_4x4x1_1x1_intrawave_v3
256,1,12800,5120,34,0,14.7015,a8w8_rowwise_256x16x64x512_16x16_1x1_32x8x1_32x8x1_1x16x1x16_4x4x1_1x1_intrawave_v3
256,1,51200,5120,30,0,50.042,a8w8_rowwise_256x32x64x512_16x16_1x2_32x8x1_32x8x1_1x32x1x8_8x8x1_1x2_intrawave_v3
256,16,100,5120,34,0,8.7447,a8w8_rowwise_256x16x64x512_16x16_1x1_32x8x1_32x8x1_1x16x1x16_4x4x1_1x1_intrawave_v3
256,16,200,5120,34,0,10.4705,a8w8_rowwise_256x16x64x512_16x16_1x1_32x8x1_32x8x1_1x16x1x16_4x4x1_1x1_intrawave_v3
256,16,800,5120,34,0,11.7219,a8w8_rowwise_256x16x64x512_16x16_1x1_32x8x1_32x8x1_1x16x1x16_4x4x1_1x1_intrawave_v3
256,16,5120,640,60,0,4.3842,a8w8_rowwise_128x16x32x128_16x16_1x1_8x16x1_8x16x1_1x16x1x8_4x4x1_1x1_intrawave_v2
256,16,5120,1280,79,0,6.1038,a8w8_rowwise_128x16x32x128_16x16_1x1_8x16x1_8x16x1_1x16x1x8_4x4x1_1x1_interwave_v2
256,16,5120,3200,79,0,9.1289,a8w8_rowwise_128x16x32x128_16x16_1x1_8x16x1_8x16x1_1x16x1x8_4x4x1_1x1_interwave_v2
256,16,5120,5120,34,0,11.1363,a8w8_rowwise_256x16x64x512_16x16_1x1_32x8x1_32x8x1_1x16x1x16_4x4x1_1x1_intrawave_v3
256,16,5120,6400,34,0,14.8838,a8w8_rowwise_256x16x64x512_16x16_1x1_32x8x1_32x8x1_1x16x1x16_4x4x1_1x1_intrawave_v3
256,16,5120,25600,34,0,38.7631,a8w8_rowwise_256x16x64x512_16x16_1x1_32x8x1_32x8x1_1x16x1x16_4x4x1_1x1_intrawave_v3
256,16,6400,5120,34,0,11.5523,a8w8_rowwise_256x16x64x512_16x16_1x1_32x8x1_32x8x1_1x16x1x16_4x4x1_1x1_intrawave_v3
256,16,12800,5120,34,0,14.2563,a8w8_rowwise_256x16x64x512_16x16_1x1_32x8x1_32x8x1_1x16x1x16_4x4x1_1x1_intrawave_v3
256,16,51200,5120,30,0,51.7349,a8w8_rowwise_256x32x64x512_16x16_1x2_32x8x1_32x8x1_1x32x1x8_8x8x1_1x2_intrawave_v3
256,32,100,5120,34,0,9.2459,a8w8_rowwise_256x16x64x512_16x16_1x1_32x8x1_32x8x1_1x16x1x16_4x4x1_1x1_intrawave_v3
256,32,200,5120,34,0,10.4825,a8w8_rowwise_256x16x64x512_16x16_1x1_32x8x1_32x8x1_1x16x1x16_4x4x1_1x1_intrawave_v3
256,32,800,5120,34,0,11.9874,a8w8_rowwise_256x16x64x512_16x16_1x1_32x8x1_32x8x1_1x16x1x16_4x4x1_1x1_intrawave_v3
256,32,5120,640,79,0,4.5986,a8w8_rowwise_128x16x32x128_16x16_1x1_8x16x1_8x16x1_1x16x1x8_4x4x1_1x1_interwave_v2
256,32,5120,1280,76,0,6.0464,a8w8_rowwise_128x32x16x128_16x16_1x1_8x16x1_8x16x1_1x16x1x8_2x2x1_1x1_interwave_v2
256,32,5120,3200,76,0,10.1191,a8w8_rowwise_128x32x16x128_16x16_1x1_8x16x1_8x16x1_1x16x1x8_2x2x1_1x1_interwave_v2
256,32,5120,5120,34,0,10.4248,a8w8_rowwise_256x16x64x512_16x16_1x1_32x8x1_32x8x1_1x16x1x16_4x4x1_1x1_intrawave_v3
256,32,5120,6400,34,0,15.0885,a8w8_rowwise_256x16x64x512_16x16_1x1_32x8x1_32x8x1_1x16x1x16_4x4x1_1x1_intrawave_v3
256,32,5120,25600,34,0,38.3258,a8w8_rowwise_256x16x64x512_16x16_1x1_32x8x1_32x8x1_1x16x1x16_4x4x1_1x1_intrawave_v3
256,32,6400,5120,34,0,10.9816,a8w8_rowwise_256x16x64x512_16x16_1x1_32x8x1_32x8x1_1x16x1x16_4x4x1_1x1_intrawave_v3
256,32,12800,5120,30,0,14.9578,a8w8_rowwise_256x32x64x512_16x16_1x2_32x8x1_32x8x1_1x32x1x8_8x8x1_1x2_intrawave_v3
256,32,51200,5120,30,0,53.9026,a8w8_rowwise_256x32x64x512_16x16_1x2_32x8x1_32x8x1_1x32x1x8_8x8x1_1x2_intrawave_v3
256,64,100,5120,34,0,9.6716,a8w8_rowwise_256x16x64x512_16x16_1x1_32x8x1_32x8x1_1x16x1x16_4x4x1_1x1_intrawave_v3
256,64,200,5120,34,0,9.9254,a8w8_rowwise_256x16x64x512_16x16_1x1_32x8x1_32x8x1_1x16x1x16_4x4x1_1x1_intrawave_v3
256,64,800,5120,34,0,12.0241,a8w8_rowwise_256x16x64x512_16x16_1x1_32x8x1_32x8x1_1x16x1x16_4x4x1_1x1_intrawave_v3
256,64,5120,640,77,0,5.0956,a8w8_rowwise_64x16x16x64_16x16_1x1_4x16x1_4x16x1_1x16x1x4_4x4x1_1x1_interwave_v2
256,64,5120,1280,76,0,6.4203,a8w8_rowwise_128x32x16x128_16x16_1x1_8x16x1_8x16x1_1x16x1x8_2x2x1_1x1_interwave_v2
256,64,5120,3200,76,0,10.7687,a8w8_rowwise_128x32x16x128_16x16_1x1_8x16x1_8x16x1_1x16x1x8_2x2x1_1x1_interwave_v2
256,64,5120,5120,30,0,11.7059,a8w8_rowwise_256x32x64x512_16x16_1x2_32x8x1_32x8x1_1x32x1x8_8x8x1_1x2_intrawave_v3
256,64,5120,6400,30,0,16.907,a8w8_rowwise_256x32x64x512_16x16_1x2_32x8x1_32x8x1_1x32x1x8_8x8x1_1x2_intrawave_v3
256,64,5120,25600,30,0,43.5801,a8w8_rowwise_256x32x64x512_16x16_1x2_32x8x1_32x8x1_1x32x1x8_8x8x1_1x2_intrawave_v3
256,64,6400,5120,30,0,12.4817,a8w8_rowwise_256x32x64x512_16x16_1x2_32x8x1_32x8x1_1x32x1x8_8x8x1_1x2_intrawave_v3
256,64,12800,5120,23,0,18.5404,a8w8_rowwise_256x64x64x512_32x32_1x1_32x8x1_32x8x1_1x32x1x8_8x8x1_1x1_intrawave_v3
256,64,51200,5120,23,0,61.5287,a8w8_rowwise_256x64x64x512_32x32_1x1_32x8x1_32x8x1_1x32x1x8_8x8x1_1x1_intrawave_v3
256,128,100,5120,34,0,10.6683,a8w8_rowwise_256x16x64x512_16x16_1x1_32x8x1_32x8x1_1x16x1x16_4x4x1_1x1_intrawave_v3
256,128,200,5120,34,0,9.652,a8w8_rowwise_256x16x64x512_16x16_1x1_32x8x1_32x8x1_1x16x1x16_4x4x1_1x1_intrawave_v3
256,128,800,5120,34,0,11.5628,a8w8_rowwise_256x16x64x512_16x16_1x1_32x8x1_32x8x1_1x16x1x16_4x4x1_1x1_intrawave_v3
256,128,5120,640,79,0,5.566,a8w8_rowwise_128x16x32x128_16x16_1x1_8x16x1_8x16x1_1x16x1x8_4x4x1_1x1_interwave_v2
256,128,5120,1280,23,0,7.6695,a8w8_rowwise_256x64x64x512_32x32_1x1_32x8x1_32x8x1_1x32x1x8_8x8x1_1x1_intrawave_v3
256,128,5120,3200,23,0,11.8363,a8w8_rowwise_256x64x64x512_32x32_1x1_32x8x1_32x8x1_1x32x1x8_8x8x1_1x1_intrawave_v3
256,128,5120,5120,23,0,14.1859,a8w8_rowwise_256x64x64x512_32x32_1x1_32x8x1_32x8x1_1x32x1x8_8x8x1_1x1_intrawave_v3
256,128,5120,6400,23,0,18.7826,a8w8_rowwise_256x64x64x512_32x32_1x1_32x8x1_32x8x1_1x32x1x8_8x8x1_1x1_intrawave_v3
256,128,5120,25600,23,0,54.0309,a8w8_rowwise_256x64x64x512_32x32_1x1_32x8x1_32x8x1_1x32x1x8_8x8x1_1x1_intrawave_v3
256,128,6400,5120,23,0,14.96,a8w8_rowwise_256x64x64x512_32x32_1x1_32x8x1_32x8x1_1x32x1x8_8x8x1_1x1_intrawave_v3
256,128,12800,5120,23,0,25.5896,a8w8_rowwise_256x64x64x512_32x32_1x1_32x8x1_32x8x1_1x32x1x8_8x8x1_1x1_intrawave_v3
256,128,51200,5120,23,0,82.0559,a8w8_rowwise_256x64x64x512_32x32_1x1_32x8x1_32x8x1_1x32x1x8_8x8x1_1x1_intrawave_v3
256,256,100,5120,34,0,10.9556,a8w8_rowwise_256x16x64x512_16x16_1x1_32x8x1_32x8x1_1x16x1x16_4x4x1_1x1_intrawave_v3
256,256,200,5120,34,0,9.8147,a8w8_rowwise_256x16x64x512_16x16_1x1_32x8x1_32x8x1_1x16x1x16_4x4x1_1x1_intrawave_v3
256,256,800,5120,34,0,11.8423,a8w8_rowwise_256x16x64x512_16x16_1x1_32x8x1_32x8x1_1x16x1x16_4x4x1_1x1_intrawave_v3
256,256,5120,640,81,0,6.6084,a8w8_rowwise_128x32x64x128_32x32_1x1_8x16x1_8x16x1_1x16x1x8_8x8x1_1x1_interwave_v2
256,256,5120,1280,15,0,8.2757,a8w8_rowwise_256x128x64x256_32x32_2x1_16x16x1_16x16x1_1x32x1x8_8x8x1_1x1_intrawave_v3
256,256,5120,3200,15,0,15.7837,a8w8_rowwise_256x128x64x256_32x32_2x1_16x16x1_16x16x1_1x32x1x8_8x8x1_1x1_intrawave_v3
256,256,5120,5120,23,0,21.8405,a8w8_rowwise_256x64x64x512_32x32_1x1_32x8x1_32x8x1_1x32x1x8_8x8x1_1x1_intrawave_v3
256,256,5120,6400,21,0,23.7832,a8w8_rowwise_256x64x128x256_32x32_1x2_16x16x1_16x16x1_1x32x1x8_8x8x1_1x1_intrawave_v3
256,256,5120,25600,23,0,86.0166,a8w8_rowwise_256x64x64x512_32x32_1x1_32x8x1_32x8x1_1x32x1x8_8x8x1_1x1_intrawave_v3
256,256,6400,5120,23,0,22.7861,a8w8_rowwise_256x64x64x512_32x32_1x1_32x8x1_32x8x1_1x32x1x8_8x8x1_1x1_intrawave_v3
256,256,12800,5120,15,0,42.5463,a8w8_rowwise_256x128x64x256_32x32_2x1_16x16x1_16x16x1_1x32x1x8_8x8x1_1x1_intrawave_v3
256,256,51200,5120,40,0,120.9285,a8w8_rowwise_256x256x224x128_16x16_8x7_8x32x1_8x32x1_1x64x1x4_8x8x1_2x1_intrawave_v3
256,512,100,5120,34,0,11.1055,a8w8_rowwise_256x16x64x512_16x16_1x1_32x8x1_32x8x1_1x16x1x16_4x4x1_1x1_intrawave_v3
256,512,200,5120,34,0,11.8774,a8w8_rowwise_256x16x64x512_16x16_1x1_32x8x1_32x8x1_1x16x1x16_4x4x1_1x1_intrawave_v3
256,512,800,5120,30,0,13.1908,a8w8_rowwise_256x32x64x512_16x16_1x2_32x8x1_32x8x1_1x32x1x8_8x8x1_1x2_intrawave_v3
256,512,5120,640,47,0,8.4036,a8w8_rowwise_256x64x64x128_32x32_1x1_8x32x1_8x32x1_1x32x1x8_8x8x1_1x1_intrawave_v3
256,512,5120,1280,22,0,12.2285,a8w8_rowwise_256x64x96x256_16x16_2x3_16x16x1_16x16x1_1x64x1x4_8x8x1_2x1_intrawave_v3
256,512,5120,3200,13,0,21.8498,a8w8_rowwise_256x128x128x128_32x32_2x2_8x32x1_8x32x1_1x32x1x8_8x8x1_1x1_intrawave_v3
256,512,5120,5120,23,0,33.1376,a8w8_rowwise_256x64x64x512_32x32_1x1_32x8x1_32x8x1_1x32x1x8_8x8x1_1x1_intrawave_v3
256,512,5120,6400,15,0,38.8017,a8w8_rowwise_256x128x64x256_32x32_2x1_16x16x1_16x16x1_1x32x1x8_8x8x1_1x1_intrawave_v3
256,512,5120,25600,23,0,131.897,a8w8_rowwise_256x64x64x512_32x32_1x1_32x8x1_32x8x1_1x32x1x8_8x8x1_1x1_intrawave_v3
256,512,6400,5120,15,0,41.3468,a8w8_rowwise_256x128x64x256_32x32_2x1_16x16x1_16x16x1_1x32x1x8_8x8x1_1x1_intrawave_v3
256,512,12800,5120,23,0,74.3061,a8w8_rowwise_256x64x64x512_32x32_1x1_32x8x1_32x8x1_1x32x1x8_8x8x1_1x1_intrawave_v3
256,512,51200,5120,40,0,223.8159,a8w8_rowwise_256x256x224x128_16x16_8x7_8x32x1_8x32x1_1x64x1x4_8x8x1_2x1_intrawave_v3
256,1024,100,5120,34,0,11.6746,a8w8_rowwise_256x16x64x512_16x16_1x1_32x8x1_32x8x1_1x16x1x16_4x4x1_1x1_intrawave_v3
256,1024,200,5120,34,0,12.0055,a8w8_rowwise_256x16x64x512_16x16_1x1_32x8x1_32x8x1_1x16x1x16_4x4x1_1x1_intrawave_v3
256,1024,800,5120,23,0,15.5235,a8w8_rowwise_256x64x64x512_32x32_1x1_32x8x1_32x8x1_1x32x1x8_8x8x1_1x1_intrawave_v3
256,1024,5120,640,11,0,11.7704,a8w8_rowwise_256x128x160x128_32x32_1x5_8x32x1_8x32x1_1x64x1x4_8x8x1_1x1_intrawave_v3
256,1024,5120,1280,11,0,17.5871,a8w8_rowwise_256x128x160x128_32x32_1x5_8x32x1_8x32x1_1x64x1x4_8x8x1_1x1_intrawave_v3
256,1024,5120,3200,11,0,27.688,a8w8_rowwise_256x128x160x128_32x32_1x5_8x32x1_8x32x1_1x64x1x4_8x8x1_1x1_intrawave_v3
256,1024,5120,5120,23,0,55.7649,a8w8_rowwise_256x64x64x512_32x32_1x1_32x8x1_32x8x1_1x32x1x8_8x8x1_1x1_intrawave_v3
256,1024,5120,6400,11,0,57.5786,a8w8_rowwise_256x128x160x128_32x32_1x5_8x32x1_8x32x1_1x64x1x4_8x8x1_1x1_intrawave_v3
256,1024,5120,25600,23,0,227.1849,a8w8_rowwise_256x64x64x512_32x32_1x1_32x8x1_32x8x1_1x32x1x8_8x8x1_1x1_intrawave_v3
256,1024,6400,5120,23,0,72.0506,a8w8_rowwise_256x64x64x512_32x32_1x1_32x8x1_32x8x1_1x32x1x8_8x8x1_1x1_intrawave_v3
256,1024,12800,5120,40,0,104.2861,a8w8_rowwise_256x256x224x128_16x16_8x7_8x32x1_8x32x1_1x64x1x4_8x8x1_2x1_intrawave_v3
256,1024,51200,5120,39,0,396.7395,a8w8_rowwise_256x224x256x128_16x16_7x8_8x32x1_8x32x1_1x32x1x8_8x8x1_1x2_intrawave_v3
256,2048,100,5120,34,0,11.6595,a8w8_rowwise_256x16x64x512_16x16_1x1_32x8x1_32x8x1_1x16x1x16_4x4x1_1x1_intrawave_v3
256,2048,200,5120,30,0,13.0876,a8w8_rowwise_256x32x64x512_16x16_1x2_32x8x1_32x8x1_1x32x1x8_8x8x1_1x2_intrawave_v3
256,2048,800,5120,23,0,24.3923,a8w8_rowwise_256x64x64x512_32x32_1x1_32x8x1_32x8x1_1x32x1x8_8x8x1_1x1_intrawave_v3
256,2048,5120,640,10,0,17.6749,a8w8_rowwise_256x128x192x128_32x32_2x3_8x32x1_8x32x1_1x32x1x8_8x8x1_1x1_intrawave_v3
256,2048,5120,1280,4,0,27.4475,a8w8_rowwise_256x256x160x128_32x32_2x5_8x32x1_8x32x1_1x64x1x4_8x8x1_2x1_intrawave_v3
256,2048,5120,3200,4,0,44.9517,a8w8_rowwise_256x256x160x128_32x32_2x5_8x32x1_8x32x1_1x64x1x4_8x8x1_2x1_intrawave_v3
256,2048,5120,5120,15,0,96.048,a8w8_rowwise_256x128x64x256_32x32_2x1_16x16x1_16x16x1_1x32x1x8_8x8x1_1x1_intrawave_v3
256,2048,5120,6400,4,0,90.0028,a8w8_rowwise_256x256x160x128_32x32_2x5_8x32x1_8x32x1_1x64x1x4_8x8x1_2x1_intrawave_v3
256,2048,5120,25600,15,0,419.2679,a8w8_rowwise_256x128x64x256_32x32_2x1_16x16x1_16x16x1_1x32x1x8_8x8x1_1x1_intrawave_v3
256,2048,6400,5120,39,0,107.5421,a8w8_rowwise_256x224x256x128_16x16_7x8_8x32x1_8x32x1_1x32x1x8_8x8x1_1x2_intrawave_v3
256,2048,12800,5120,39,0,188.6903,a8w8_rowwise_256x224x256x128_16x16_7x8_8x32x1_8x32x1_1x32x1x8_8x8x1_1x2_intrawave_v3
256,2048,51200,5120,39,0,756.332,a8w8_rowwise_256x224x256x128_16x16_7x8_8x32x1_8x32x1_1x32x1x8_8x8x1_1x2_intrawave_v3
256,4096,100,5120,34,0,16.1651,a8w8_rowwise_256x16x64x512_16x16_1x1_32x8x1_32x8x1_1x16x1x16_4x4x1_1x1_intrawave_v3
256,4096,200,5120,23,0,15.2341,a8w8_rowwise_256x64x64x512_32x32_1x1_32x8x1_32x8x1_1x32x1x8_8x8x1_1x1_intrawave_v3
256,4096,800,5120,15,0,36.4711,a8w8_rowwise_256x128x64x256_32x32_2x1_16x16x1_16x16x1_1x32x1x8_8x8x1_1x1_intrawave_v3
256,4096,5120,640,13,0,32.4583,a8w8_rowwise_256x128x128x128_32x32_2x2_8x32x1_8x32x1_1x32x1x8_8x8x1_1x1_intrawave_v3
256,4096,5120,1280,13,0,50.6317,a8w8_rowwise_256x128x128x128_32x32_2x2_8x32x1_8x32x1_1x32x1x8_8x8x1_1x1_intrawave_v3
256,4096,5120,3200,4,0,86.6115,a8w8_rowwise_256x256x160x128_32x32_2x5_8x32x1_8x32x1_1x64x1x4_8x8x1_2x1_intrawave_v3
256,4096,5120,5120,15,0,177.0814,a8w8_rowwise_256x128x64x256_32x32_2x1_16x16x1_16x16x1_1x32x1x8_8x8x1_1x1_intrawave_v3
256,4096,5120,6400,4,0,162.2341,a8w8_rowwise_256x256x160x128_32x32_2x5_8x32x1_8x32x1_1x64x1x4_8x8x1_2x1_intrawave_v3
256,4096,5120,25600,15,0,782.4893,a8w8_rowwise_256x128x64x256_32x32_2x1_16x16x1_16x16x1_1x32x1x8_8x8x1_1x1_intrawave_v3
256,4096,6400,5120,39,0,188.523,a8w8_rowwise_256x224x256x128_16x16_7x8_8x32x1_8x32x1_1x32x1x8_8x8x1_1x2_intrawave_v3
256,4096,12800,5120,39,0,356.6531,a8w8_rowwise_256x224x256x128_16x16_7x8_8x32x1_8x32x1_1x32x1x8_8x8x1_1x2_intrawave_v3
256,4096,51200,5120,1,0,1418.8126,a8w8_rowwise_256x256x256x128_32x32_4x4_8x32x1_8x32x1_1x32x1x8_8x8x1_1x1_intrawave_v3
256,8192,100,5120,29,0,27.2037,a8w8_rowwise_256x32x96x256_16x16_1x3_16x16x1_16x16x1_1x32x1x8_4x4x1_1x1_intrawave_v3
256,8192,200,5120,21,0,25.2734,a8w8_rowwise_256x64x128x256_32x32_1x2_16x16x1_16x16x1_1x32x1x8_8x8x1_1x1_intrawave_v3
256,8192,800,5120,41,0,65.9722,a8w8_rowwise_256x128x128x128_32x32_2x2_8x32x1_8x32x1_1x32x1x8_8x8x1_1x1_intrawave_v5
256,8192,5120,640,42,0,55.1814,a8w8_rowwise_256x128x256x64_32x32_2x4_4x64x1_4x64x1_1x32x1x8_8x8x1_1x1_interwave_v1
256,8192,5120,1280,39,0,86.4091,a8w8_rowwise_256x224x256x128_16x16_7x8_8x32x1_8x32x1_1x32x1x8_8x8x1_1x2_intrawave_v3
256,8192,5120,3200,40,0,149.3935,a8w8_rowwise_256x256x224x128_16x16_8x7_8x32x1_8x32x1_1x64x1x4_8x8x1_2x1_intrawave_v3
256,8192,5120,5120,39,0,277.9848,a8w8_rowwise_256x224x256x128_16x16_7x8_8x32x1_8x32x1_1x32x1x8_8x8x1_1x2_intrawave_v3
256,8192,5120,6400,40,0,276.3348,a8w8_rowwise_256x256x224x128_16x16_8x7_8x32x1_8x32x1_1x64x1x4_8x8x1_2x1_intrawave_v3
256,8192,5120,25600,39,0,1513.1737,a8w8_rowwise_256x224x256x128_16x16_7x8_8x32x1_8x32x1_1x32x1x8_8x8x1_1x2_intrawave_v3
256,8192,6400,5120,39,0,359.0195,a8w8_rowwise_256x224x256x128_16x16_7x8_8x32x1_8x32x1_1x32x1x8_8x8x1_1x2_intrawave_v3
256,8192,12800,5120,39,0,683.3672,a8w8_rowwise_256x224x256x128_16x16_7x8_8x32x1_8x32x1_1x32x1x8_8x8x1_1x2_intrawave_v3
256,8192,51200,5120,1,0,2639.7599,a8w8_rowwise_256x256x256x128_32x32_4x4_8x32x1_8x32x1_1x32x1x8_8x8x1_1x1_intrawave_v3
256,16384,100,5120,27,0,42.6746,a8w8_rowwise_256x32x160x256_16x16_1x5_16x16x1_16x16x1_1x32x1x8_4x4x1_1x1_intrawave_v3
256,16384,200,5120,21,0,44.0772,a8w8_rowwise_256x64x128x256_32x32_1x2_16x16x1_16x16x1_1x32x1x8_8x8x1_1x1_intrawave_v3
256,16384,800,5120,1,0,111.2384,a8w8_rowwise_256x256x256x128_32x32_4x4_8x32x1_8x32x1_1x32x1x8_8x8x1_1x1_intrawave_v3
256,16384,5120,640,43,0,99.8836,a8w8_rowwise_256x256x128x64_32x32_4x2_4x64x1_4x64x1_1x32x1x8_8x8x1_1x1_interwave_v1
256,16384,5120,1280,1,0,153.6015,a8w8_rowwise_256x256x256x128_32x32_4x4_8x32x1_8x32x1_1x32x1x8_8x8x1_1x1_intrawave_v3
256,16384,5120,3200,1,0,271.2735,a8w8_rowwise_256x256x256x128_32x32_4x4_8x32x1_8x32x1_1x32x1x8_8x8x1_1x1_intrawave_v3
256,16384,5120,5120,1,0,518.1604,a8w8_rowwise_256x256x256x128_32x32_4x4_8x32x1_8x32x1_1x32x1x8_8x8x1_1x1_intrawave_v3
256,16384,5120,6400,1,0,543.7765,a8w8_rowwise_256x256x256x128_32x32_4x4_8x32x1_8x32x1_1x32x1x8_8x8x1_1x1_intrawave_v3
256,16384,5120,25600,1,0,2869.8056,a8w8_rowwise_256x256x256x128_32x32_4x4_8x32x1_8x32x1_1x32x1x8_8x8x1_1x1_intrawave_v3
256,16384,6400,5120,40,0,690.0605,a8w8_rowwise_256x256x224x128_16x16_8x7_8x32x1_8x32x1_1x64x1x4_8x8x1_2x1_intrawave_v3
256,16384,12800,5120,39,0,1303.8826,a8w8_rowwise_256x224x256x128_16x16_7x8_8x32x1_8x32x1_1x32x1x8_8x8x1_1x2_intrawave_v3
256,16384,51200,5120,1,0,5290.8019,a8w8_rowwise_256x256x256x128_32x32_4x4_8x32x1_8x32x1_1x32x1x8_8x8x1_1x1_intrawave_v3
256,32768,100,5120,27,0,78.5325,a8w8_rowwise_256x32x160x256_16x16_1x5_16x16x1_16x16x1_1x32x1x8_4x4x1_1x1_intrawave_v3
256,32768,200,5120,21,0,82.0643,a8w8_rowwise_256x64x128x256_32x32_1x2_16x16x1_16x16x1_1x32x1x8_8x8x1_1x1_intrawave_v3
256,32768,800,5120,1,0,216.0528,a8w8_rowwise_256x256x256x128_32x32_4x4_8x32x1_8x32x1_1x32x1x8_8x8x1_1x1_intrawave_v3
256,32768,5120,640,43,0,191.0117,a8w8_rowwise_256x256x128x64_32x32_4x2_4x64x1_4x64x1_1x32x1x8_8x8x1_1x1_interwave_v1
256,32768,5120,1280,1,0,299.0856,a8w8_rowwise_256x256x256x128_32x32_4x4_8x32x1_8x32x1_1x32x1x8_8x8x1_1x1_intrawave_v3
256,32768,5120,3200,1,0,538.4921,a8w8_rowwise_256x256x256x128_32x32_4x4_8x32x1_8x32x1_1x32x1x8_8x8x1_1x1_intrawave_v3
256,32768,5120,5120,40,0,999.0598,a8w8_rowwise_256x256x224x128_16x16_8x7_8x32x1_8x32x1_1x64x1x4_8x8x1_2x1_intrawave_v3
256,32768,5120,6400,1,0,1028.2651,a8w8_rowwise_256x256x256x128_32x32_4x4_8x32x1_8x32x1_1x32x1x8_8x8x1_1x1_intrawave_v3
256,32768,5120,25600,1,0,5734.5832,a8w8_rowwise_256x256x256x128_32x32_4x4_8x32x1_8x32x1_1x32x1x8_8x8x1_1x1_intrawave_v3
256,32768,6400,5120,40,0,1274.1106,a8w8_rowwise_256x256x224x128_16x16_8x7_8x32x1_8x32x1_1x64x1x4_8x8x1_2x1_intrawave_v3
256,32768,12800,5120,39,0,2481.3683,a8w8_rowwise_256x224x256x128_16x16_7x8_8x32x1_8x32x1_1x32x1x8_8x8x1_1x2_intrawave_v3
256,32768,51200,5120,1,0,10610.0611,a8w8_rowwise_256x256x256x128_32x32_4x4_8x32x1_8x32x1_1x32x1x8_8x8x1_1x1_intrawave_v3
304,1,1280,8192,34,0,15.7779,a8w8_rowwise_256x16x64x512_16x16_1x1_32x8x1_32x8x1_1x16x1x16_4x4x1_1x1_intrawave_v3
304,1,2560,8192,34,0,17.0078,a8w8_rowwise_256x16x64x512_16x16_1x1_32x8x1_32x8x1_1x16x1x16_4x4x1_1x1_intrawave_v3
304,1,7168,8192,30,0,25.836,a8w8_rowwise_256x32x64x512_16x16_1x2_32x8x1_32x8x1_1x32x1x8_8x8x1_1x2_intrawave_v3
304,1,8192,1024,59,0,7.3637,a8w8_rowwise_64x16x16x128_16x16_1x1_8x8x1_8x8x1_1x16x1x4_4x4x1_1x1_intrawave_v2
304,1,8192,2048,77,0,9.3308,a8w8_rowwise_64x16x16x64_16x16_1x1_4x16x1_4x16x1_1x16x1x4_4x4x1_1x1_interwave_v2
304,1,8192,3584,34,0,10.9159,a8w8_rowwise_256x16x64x512_16x16_1x1_32x8x1_32x8x1_1x16x1x16_4x4x1_1x1_intrawave_v3
304,1,8192,7168,34,0,20.308,a8w8_rowwise_256x16x64x512_16x16_1x1_32x8x1_32x8x1_1x16x1x16_4x4x1_1x1_intrawave_v3
304,1,8192,8192,34,0,28.8985,a8w8_rowwise_256x16x64x512_16x16_1x1_32x8x1_32x8x1_1x16x1x16_4x4x1_1x1_intrawave_v3
304,1,8192,28672,34,0,81.7328,a8w8_rowwise_256x16x64x512_16x16_1x1_32x8x1_32x8x1_1x16x1x16_4x4x1_1x1_intrawave_v3
304,1,10240,8192,34,0,32.8078,a8w8_rowwise_256x16x64x512_16x16_1x1_32x8x1_32x8x1_1x16x1x16_4x4x1_1x1_intrawave_v3
304,1,14336,8192,79,0,41.3525,a8w8_rowwise_128x16x32x128_16x16_1x1_8x16x1_8x16x1_1x16x1x8_4x4x1_1x1_interwave_v2
304,1,57344,8192,50,0,143.3251,a8w8_rowwise_128x16x32x128_16x16_1x1_8x16x1_8x16x1_1x16x1x8_4x4x1_1x1_intrawave_v1
304,16,1280,8192,34,0,12.8201,a8w8_rowwise_256x16x64x512_16x16_1x1_32x8x1_32x8x1_1x16x1x16_4x4x1_1x1_intrawave_v3
304,16,2560,8192,34,0,13.8281,a8w8_rowwise_256x16x64x512_16x16_1x1_32x8x1_32x8x1_1x16x1x16_4x4x1_1x1_intrawave_v3
304,16,7168,8192,79,0,25.6622,a8w8_rowwise_128x16x32x128_16x16_1x1_8x16x1_8x16x1_1x16x1x8_4x4x1_1x1_interwave_v2
304,16,8192,1024,79,0,7.2078,a8w8_rowwise_128x16x32x128_16x16_1x1_8x16x1_8x16x1_1x16x1x8_4x4x1_1x1_interwave_v2
304,16,8192,2048,34,0,8.1866,a8w8_rowwise_256x16x64x512_16x16_1x1_32x8x1_32x8x1_1x16x1x16_4x4x1_1x1_intrawave_v3
304,16,8192,3584,79,0,11.3802,a8w8_rowwise_128x16x32x128_16x16_1x1_8x16x1_8x16x1_1x16x1x8_4x4x1_1x1_interwave_v2
304,16,8192,7168,34,0,18.698,a8w8_rowwise_256x16x64x512_16x16_1x1_32x8x1_32x8x1_1x16x1x16_4x4x1_1x1_intrawave_v3
304,16,8192,8192,79,0,28.746,a8w8_rowwise_128x16x32x128_16x16_1x1_8x16x1_8x16x1_1x16x1x8_4x4x1_1x1_interwave_v2
304,16,8192,28672,34,0,82.2581,a8w8_rowwise_256x16x64x512_16x16_1x1_32x8x1_32x8x1_1x16x1x16_4x4x1_1x1_intrawave_v3
304,16,10240,8192,79,0,31.2059,a8w8_rowwise_128x16x32x128_16x16_1x1_8x16x1_8x16x1_1x16x1x8_4x4x1_1x1_interwave_v2
304,16,14336,8192,79,0,39.1453,a8w8_rowwise_128x16x32x128_16x16_1x1_8x16x1_8x16x1_1x16x1x8_4x4x1_1x1_interwave_v2
304,16,57344,8192,79,0,147.6305,a8w8_rowwise_128x16x32x128_16x16_1x1_8x16x1_8x16x1_1x16x1x8_4x4x1_1x1_interwave_v2
304,32,1280,8192,34,0,12.9593,a8w8_rowwise_256x16x64x512_16x16_1x1_32x8x1_32x8x1_1x16x1x16_4x4x1_1x1_intrawave_v3
304,32,2560,8192,34,0,13.9288,a8w8_rowwise_256x16x64x512_16x16_1x1_32x8x1_32x8x1_1x16x1x16_4x4x1_1x1_intrawave_v3
304,32,7168,8192,34,0,26.5978,a8w8_rowwise_256x16x64x512_16x16_1x1_32x8x1_32x8x1_1x16x1x16_4x4x1_1x1_intrawave_v3
304,32,8192,1024,76,0,7.0833,a8w8_rowwise_128x32x16x128_16x16_1x1_8x16x1_8x16x1_1x16x1x8_2x2x1_1x1_interwave_v2
304,32,8192,2048,34,0,9.3161,a8w8_rowwise_256x16x64x512_16x16_1x1_32x8x1_32x8x1_1x16x1x16_4x4x1_1x1_intrawave_v3
304,32,8192,3584,34,0,13.0503,a8w8_rowwise_256x16x64x512_16x16_1x1_32x8x1_32x8x1_1x16x1x16_4x4x1_1x1_intrawave_v3
304,32,8192,7168,30,0,21.4525,a8w8_rowwise_256x32x64x512_16x16_1x2_32x8x1_32x8x1_1x32x1x8_8x8x1_1x2_intrawave_v3
304,32,8192,8192,34,0,30.2517,a8w8_rowwise_256x16x64x512_16x16_1x1_32x8x1_32x8x1_1x16x1x16_4x4x1_1x1_intrawave_v3
304,32,8192,28672,34,0,86.4302,a8w8_rowwise_256x16x64x512_16x16_1x1_32x8x1_32x8x1_1x16x1x16_4x4x1_1x1_intrawave_v3
304,32,10240,8192,30,0,35.3704,a8w8_rowwise_256x32x64x512_16x16_1x2_32x8x1_32x8x1_1x32x1x8_8x8x1_1x2_intrawave_v3
304,32,14336,8192,57,0,49.6085,a8w8_rowwise_128x32x16x128_16x16_1x1_8x16x1_8x16x1_1x16x1x8_2x2x1_1x1_intrawave_v2
304,32,57344,8192,62,0,161.2319,a8w8_rowwise_128x32x64x128_32x32_1x1_8x16x1_8x16x1_1x16x1x8_8x8x1_1x1_intrawave_v2
304,64,192,1024,60,0,4.0236,a8w8_rowwise_128x16x32x128_16x16_1x1_8x16x1_8x16x1_1x16x1x8_4x4x1_1x1_intrawave_v2
304,64,1280,8192,34,0,12.9411,a8w8_rowwise_256x16x64x512_16x16_1x1_32x8x1_32x8x1_1x16x1x16_4x4x1_1x1_intrawave_v3
304,64,2560,8192,34,0,15.1543,a8w8_rowwise_256x16x64x512_16x16_1x1_32x8x1_32x8x1_1x16x1x16_4x4x1_1x1_intrawave_v3
304,64,7168,8192,30,0,29.7078,a8w8_rowwise_256x32x64x512_16x16_1x2_32x8x1_32x8x1_1x32x1x8_8x8x1_1x2_intrawave_v3
304,64,8192,2048,30,0,11.0649,a8w8_rowwise_256x32x64x512_16x16_1x2_32x8x1_32x8x1_1x32x1x8_8x8x1_1x2_intrawave_v3
304,64,8192,3584,30,0,15.1343,a8w8_rowwise_256x32x64x512_16x16_1x2_32x8x1_32x8x1_1x32x1x8_8x8x1_1x2_intrawave_v3
304,64,8192,7168,23,0,26.3884,a8w8_rowwise_256x64x64x512_32x32_1x1_32x8x1_32x8x1_1x32x1x8_8x8x1_1x1_intrawave_v3
304,64,8192,8192,30,0,32.1992,a8w8_rowwise_256x32x64x512_16x16_1x2_32x8x1_32x8x1_1x32x1x8_8x8x1_1x2_intrawave_v3
304,64,8192,28672,30,0,99.0014,a8w8_rowwise_256x32x64x512_16x16_1x2_32x8x1_32x8x1_1x32x1x8_8x8x1_1x2_intrawave_v3
304,64,10240,8192,23,0,39.8615,a8w8_rowwise_256x64x64x512_32x32_1x1_32x8x1_32x8x1_1x32x1x8_8x8x1_1x1_intrawave_v3
304,64,14336,8192,28,0,55.5133,a8w8_rowwise_256x32x128x256_32x32_1x1_16x16x1_16x16x1_1x32x1x8_8x8x1_1x1_intrawave_v3
304,64,57344,8192,18,0,181.0358,a8w8_rowwise_256x64x192x256_32x32_1x3_16x16x1_16x16x1_1x32x1x8_8x8x1_1x1_intrawave_v3
304,128,1280,8192,34,0,13.706,a8w8_rowwise_256x16x64x512_16x16_1x1_32x8x1_32x8x1_1x16x1x16_4x4x1_1x1_intrawave_v3
304,128,2560,8192,30,0,18.5523,a8w8_rowwise_256x32x64x512_16x16_1x2_32x8x1_32x8x1_1x32x1x8_8x8x1_1x2_intrawave_v3
304,128,7168,8192,23,0,37.6681,a8w8_rowwise_256x64x64x512_32x32_1x1_32x8x1_32x8x1_1x32x1x8_8x8x1_1x1_intrawave_v3
304,128,8192,1024,47,0,9.785,a8w8_rowwise_256x64x64x128_32x32_1x1_8x32x1_8x32x1_1x32x1x8_8x8x1_1x1_intrawave_v3
304,128,8192,2048,23,0,13.3875,a8w8_rowwise_256x64x64x512_32x32_1x1_32x8x1_32x8x1_1x32x1x8_8x8x1_1x1_intrawave_v3
304,128,8192,3584,23,0,20.0979,a8w8_rowwise_256x64x64x512_32x32_1x1_32x8x1_32x8x1_1x32x1x8_8x8x1_1x1_intrawave_v3
304,128,8192,7168,23,0,34.452,a8w8_rowwise_256x64x64x512_32x32_1x1_32x8x1_32x8x1_1x32x1x8_8x8x1_1x1_intrawave_v3
304,128,8192,8192,23,0,40.8281,a8w8_rowwise_256x64x64x512_32x32_1x1_32x8x1_32x8x1_1x32x1x8_8x8x1_1x1_intrawave_v3
304,128,8192,28672,23,0,138.6632,a8w8_rowwise_256x64x64x512_32x32_1x1_32x8x1_32x8x1_1x32x1x8_8x8x1_1x1_intrawave_v3
304,128,10240,8192,21,0,54.2831,a8w8_rowwise_256x64x128x256_32x32_1x2_16x16x1_16x16x1_1x32x1x8_8x8x1_1x1_intrawave_v3
304,128,14336,8192,21,0,68.6612,a8w8_rowwise_256x64x128x256_32x32_1x2_16x16x1_16x16x1_1x32x1x8_8x8x1_1x1_intrawave_v3
304,128,57344,8192,10,0,216.3683,a8w8_rowwise_256x128x192x128_32x32_2x3_8x32x1_8x32x1_1x32x1x8_8x8x1_1x1_intrawave_v3
304,256,1280,8192,30,0,19.1508,a8w8_rowwise_256x32x64x512_16x16_1x2_32x8x1_32x8x1_1x32x1x8_8x8x1_1x2_intrawave_v3
304,256,2560,8192,23,0,27.1571,a8w8_rowwise_256x64x64x512_32x32_1x1_32x8x1_32x8x1_1x32x1x8_8x8x1_1x1_intrawave_v3
304,256,7168,8192,21,0,59.3987,a8w8_rowwise_256x64x128x256_32x32_1x2_16x16x1_16x16x1_1x32x1x8_8x8x1_1x1_intrawave_v3
304,256,8192,1024,15,0,13.116,a8w8_rowwise_256x128x64x256_32x32_2x1_16x16x1_16x16x1_1x32x1x8_8x8x1_1x1_intrawave_v3
304,256,8192,2048,15,0,19.8307,a8w8_rowwise_256x128x64x256_32x32_2x1_16x16x1_16x16x1_1x32x1x8_8x8x1_1x1_intrawave_v3
304,256,8192,3584,21,0,30.643,a8w8_rowwise_256x64x128x256_32x32_1x2_16x16x1_16x16x1_1x32x1x8_8x8x1_1x1_intrawave_v3
304,256,8192,7168,15,0,56.5659,a8w8_rowwise_256x128x64x256_32x32_2x1_16x16x1_16x16x1_1x32x1x8_8x8x1_1x1_intrawave_v3
304,256,8192,8192,21,0,63.4391,a8w8_rowwise_256x64x128x256_32x32_1x2_16x16x1_16x16x1_1x32x1x8_8x8x1_1x1_intrawave_v3
304,256,8192,28672,21,0,207.9264,a8w8_rowwise_256x64x128x256_32x32_1x2_16x16x1_16x16x1_1x32x1x8_8x8x1_1x1_intrawave_v3
304,256,10240,8192,12,0,78.6809,a8w8_rowwise_256x128x128x256_32x32_2x2_16x16x1_16x16x1_1x32x1x8_8x8x1_1x1_intrawave_v3
304,256,14336,8192,14,0,98.3073,a8w8_rowwise_256x128x96x256_32x32_1x3_16x16x1_16x16x1_1x64x1x4_8x8x1_1x1_intrawave_v3
304,256,57344,8192,40,0,299.9197,a8w8_rowwise_256x256x224x128_16x16_8x7_8x32x1_8x32x1_1x64x1x4_8x8x1_2x1_intrawave_v3
304,512,1280,8192,23,0,27.4017,a8w8_rowwise_256x64x64x512_32x32_1x1_32x8x1_32x8x1_1x32x1x8_8x8x1_1x1_intrawave_v3
304,512,2560,8192,21,0,49.2271,a8w8_rowwise_256x64x128x256_32x32_1x2_16x16x1_16x16x1_1x32x1x8_8x8x1_1x1_intrawave_v3
304,512,7168,8192,12,0,91.2668,a8w8_rowwise_256x128x128x256_32x32_2x2_16x16x1_16x16x1_1x32x1x8_8x8x1_1x1_intrawave_v3
304,512,8192,1024,12,0,19.7535,a8w8_rowwise_256x128x128x256_32x32_2x2_16x16x1_16x16x1_1x32x1x8_8x8x1_1x1_intrawave_v3
304,512,8192,2048,12,0,30.1083,a8w8_rowwise_256x128x128x256_32x32_2x2_16x16x1_16x16x1_1x32x1x8_8x8x1_1x1_intrawave_v3
304,512,8192,3584,12,0,50.0641,a8w8_rowwise_256x128x128x256_32x32_2x2_16x16x1_16x16x1_1x32x1x8_8x8x1_1x1_intrawave_v3
304,512,8192,7168,12,0,86.1488,a8w8_rowwise_256x128x128x256_32x32_2x2_16x16x1_16x16x1_1x32x1x8_8x8x1_1x1_intrawave_v3
304,512,8192,8192,13,0,101.9925,a8w8_rowwise_256x128x128x128_32x32_2x2_8x32x1_8x32x1_1x32x1x8_8x8x1_1x1_intrawave_v3
304,512,8192,28672,12,0,303.7385,a8w8_rowwise_256x128x128x256_32x32_2x2_16x16x1_16x16x1_1x32x1x8_8x8x1_1x1_intrawave_v3
304,512,10240,8192,11,0,124.8914,a8w8_rowwise_256x128x160x128_32x32_1x5_8x32x1_8x32x1_1x64x1x4_8x8x1_1x1_intrawave_v3
304,512,14336,8192,10,0,152.7875,a8w8_rowwise_256x128x192x128_32x32_2x3_8x32x1_8x32x1_1x32x1x8_8x8x1_1x1_intrawave_v3
304,512,57344,8192,3,0,553.9615,a8w8_rowwise_256x256x192x128_32x32_4x3_8x32x1_8x32x1_1x32x1x8_8x8x1_1x1_intrawave_v3
304,1024,1280,8192,21,0,49.8521,a8w8_rowwise_256x64x128x256_32x32_1x2_16x16x1_16x16x1_1x32x1x8_8x8x1_1x1_intrawave_v3
304,1024,2560,8192,14,0,72.1886,a8w8_rowwise_256x128x96x256_32x32_1x3_16x16x1_16x16x1_1x64x1x4_8x8x1_1x1_intrawave_v3
304,1024,7168,8192,10,0,152.5955,a8w8_rowwise_256x128x192x128_32x32_2x3_8x32x1_8x32x1_1x32x1x8_8x8x1_1x1_intrawave_v3
304,1024,8192,1024,13,0,33.0699,a8w8_rowwise_256x128x128x128_32x32_2x2_8x32x1_8x32x1_1x32x1x8_8x8x1_1x1_intrawave_v3
304,1024,8192,2048,13,0,52.6968,a8w8_rowwise_256x128x128x128_32x32_2x2_8x32x1_8x32x1_1x32x1x8_8x8x1_1x1_intrawave_v3
304,1024,8192,3584,5,0,84.354,a8w8_rowwise_256x256x128x128_32x32_4x2_8x32x1_8x32x1_1x32x1x8_8x8x1_1x1_intrawave_v3
304,1024,8192,7168,13,0,149.9654,a8w8_rowwise_256x128x128x128_32x32_2x2_8x32x1_8x32x1_1x32x1x8_8x8x1_1x1_intrawave_v3
304,1024,8192,8192,13,0,170.7549,a8w8_rowwise_256x128x128x128_32x32_2x2_8x32x1_8x32x1_1x32x1x8_8x8x1_1x1_intrawave_v3
304,1024,8192,28672,41,0,574.4434,a8w8_rowwise_256x128x128x128_32x32_2x2_8x32x1_8x32x1_1x32x1x8_8x8x1_1x1_intrawave_v5
304,1024,10240,8192,4,0,201.4766,a8w8_rowwise_256x256x160x128_32x32_2x5_8x32x1_8x32x1_1x64x1x4_8x8x1_2x1_intrawave_v3
304,1024,14336,8192,40,0,266.5684,a8w8_rowwise_256x256x224x128_16x16_8x7_8x32x1_8x32x1_1x64x1x4_8x8x1_2x1_intrawave_v3
304,1024,57344,8192,1,0,971.2064,a8w8_rowwise_256x256x256x128_32x32_4x4_8x32x1_8x32x1_1x32x1x8_8x8x1_1x1_intrawave_v3
304,2048,1280,8192,14,0,74.6196,a8w8_rowwise_256x128x96x256_32x32_1x3_16x16x1_16x16x1_1x64x1x4_8x8x1_1x1_intrawave_v3
304,2048,2560,8192,11,0,120.0923,a8w8_rowwise_256x128x160x128_32x32_1x5_8x32x1_8x32x1_1x64x1x4_8x8x1_1x1_intrawave_v3
304,2048,7168,8192,40,0,260.3778,a8w8_rowwise_256x256x224x128_16x16_8x7_8x32x1_8x32x1_1x64x1x4_8x8x1_2x1_intrawave_v3
304,2048,8192,1024,2,0,57.0491,a8w8_rowwise_256x256x224x128_32x32_2x7_8x32x1_8x32x1_1x64x1x4_8x8x1_2x1_intrawave_v3
304,2048,8192,2048,1,0,90.1338,a8w8_rowwise_256x256x256x128_32x32_4x4_8x32x1_8x32x1_1x32x1x8_8x8x1_1x1_intrawave_v3
304,2048,8192,3584,2,0,145.7121,a8w8_rowwise_256x256x224x128_32x32_2x7_8x32x1_8x32x1_1x64x1x4_8x8x1_2x1_intrawave_v3
304,2048,8192,7168,2,0,255.4612,a8w8_rowwise_256x256x224x128_32x32_2x7_8x32x1_8x32x1_1x64x1x4_8x8x1_2x1_intrawave_v3
304,2048,8192,8192,2,0,295.0734,a8w8_rowwise_256x256x224x128_32x32_2x7_8x32x1_8x32x1_1x64x1x4_8x8x1_2x1_intrawave_v3
304,2048,8192,28672,1,0,954.3322,a8w8_rowwise_256x256x256x128_32x32_4x4_8x32x1_8x32x1_1x32x1x8_8x8x1_1x1_intrawave_v3
304,2048,10240,8192,4,0,381.6516,a8w8_rowwise_256x256x160x128_32x32_2x5_8x32x1_8x32x1_1x64x1x4_8x8x1_2x1_intrawave_v3
304,2048,14336,8192,3,0,493.5015,a8w8_rowwise_256x256x192x128_32x32_4x3_8x32x1_8x32x1_1x32x1x8_8x8x1_1x1_intrawave_v3
304,2048,57344,8192,1,0,1845.4552,a8w8_rowwise_256x256x256x128_32x32_4x4_8x32x1_8x32x1_1x32x1x8_8x8x1_1x1_intrawave_v3
304,4096,1280,8192,11,0,122.069,a8w8_rowwise_256x128x160x128_32x32_1x5_8x32x1_8x32x1_1x64x1x4_8x8x1_1x1_intrawave_v3
304,4096,2560,8192,4,0,201.1048,a8w8_rowwise_256x256x160x128_32x32_2x5_8x32x1_8x32x1_1x64x1x4_8x8x1_2x1_intrawave_v3
304,4096,7168,8192,40,0,503.6203,a8w8_rowwise_256x256x224x128_16x16_8x7_8x32x1_8x32x1_1x64x1x4_8x8x1_2x1_intrawave_v3
304,4096,8192,1024,39,0,107.7526,a8w8_rowwise_256x224x256x128_16x16_7x8_8x32x1_8x32x1_1x32x1x8_8x8x1_1x2_intrawave_v3
304,4096,8192,2048,39,0,174.958,a8w8_rowwise_256x224x256x128_16x16_7x8_8x32x1_8x32x1_1x32x1x8_8x8x1_1x2_intrawave_v3
304,4096,8192,3584,39,0,275.3333,a8w8_rowwise_256x224x256x128_16x16_7x8_8x32x1_8x32x1_1x32x1x8_8x8x1_1x2_intrawave_v3
304,4096,8192,7168,40,0,510.9572,a8w8_rowwise_256x256x224x128_16x16_8x7_8x32x1_8x32x1_1x64x1x4_8x8x1_2x1_intrawave_v3
304,4096,8192,8192,1,0,563.1655,a8w8_rowwise_256x256x256x128_32x32_4x4_8x32x1_8x32x1_1x32x1x8_8x8x1_1x1_intrawave_v3
304,4096,8192,28672,1,0,1876.4926,a8w8_rowwise_256x256x256x128_32x32_4x4_8x32x1_8x32x1_1x32x1x8_8x8x1_1x1_intrawave_v3
304,4096,10240,8192,3,0,712.1066,a8w8_rowwise_256x256x192x128_32x32_4x3_8x32x1_8x32x1_1x32x1x8_8x8x1_1x1_intrawave_v3
304,4096,14336,8192,1,0,939.9363,a8w8_rowwise_256x256x256x128_32x32_4x4_8x32x1_8x32x1_1x32x1x8_8x8x1_1x1_intrawave_v3
304,4096,57344,8192,1,0,3645.0412,a8w8_rowwise_256x256x256x128_32x32_4x4_8x32x1_8x32x1_1x32x1x8_8x8x1_1x1_intrawave_v3
304,8192,1280,8192,4,0,202.0433,a8w8_rowwise_256x256x160x128_32x32_2x5_8x32x1_8x32x1_1x64x1x4_8x8x1_2x1_intrawave_v3
304,8192,2560,8192,4,0,396.2735,a8w8_rowwise_256x256x160x128_32x32_2x5_8x32x1_8x32x1_1x64x1x4_8x8x1_2x1_intrawave_v3
304,8192,7168,8192,1,0,930.9368,a8w8_rowwise_256x256x256x128_32x32_4x4_8x32x1_8x32x1_1x32x1x8_8x8x1_1x1_intrawave_v3
304,8192,8192,1024,39,0,210.2368,a8w8_rowwise_256x224x256x128_16x16_7x8_8x32x1_8x32x1_1x32x1x8_8x8x1_1x2_intrawave_v3
304,8192,8192,2048,39,0,338.1768,a8w8_rowwise_256x224x256x128_16x16_7x8_8x32x1_8x32x1_1x32x1x8_8x8x1_1x2_intrawave_v3
304,8192,8192,3584,2,0,531.6181,a8w8_rowwise_256x256x224x128_32x32_2x7_8x32x1_8x32x1_1x64x1x4_8x8x1_2x1_intrawave_v3
304,8192,8192,7168,39,0,979.8241,a8w8_rowwise_256x224x256x128_16x16_7x8_8x32x1_8x32x1_1x32x1x8_8x8x1_1x2_intrawave_v3
304,8192,8192,8192,1,0,1117.9731,a8w8_rowwise_256x256x256x128_32x32_4x4_8x32x1_8x32x1_1x32x1x8_8x8x1_1x1_intrawave_v3
304,8192,8192,28672,1,0,3852.5607,a8w8_rowwise_256x256x256x128_32x32_4x4_8x32x1_8x32x1_1x32x1x8_8x8x1_1x1_intrawave_v3
304,8192,10240,8192,1,0,1376.4385,a8w8_rowwise_256x256x256x128_32x32_4x4_8x32x1_8x32x1_1x32x1x8_8x8x1_1x1_intrawave_v3
304,8192,14336,8192,1,0,1835.2131,a8w8_rowwise_256x256x256x128_32x32_4x4_8x32x1_8x32x1_1x32x1x8_8x8x1_1x1_intrawave_v3
304,8192,57344,8192,1,0,7290.8769,a8w8_rowwise_256x256x256x128_32x32_4x4_8x32x1_8x32x1_1x32x1x8_8x8x1_1x1_intrawave_v3
304,16384,1280,8192,4,0,401.4724,a8w8_rowwise_256x256x160x128_32x32_2x5_8x32x1_8x32x1_1x64x1x4_8x8x1_2x1_intrawave_v3
304,16384,2560,8192,3,0,737.4866,a8w8_rowwise_256x256x192x128_32x32_4x3_8x32x1_8x32x1_1x32x1x8_8x8x1_1x1_intrawave_v3
304,16384,7168,8192,1,0,1875.8183,a8w8_rowwise_256x256x256x128_32x32_4x4_8x32x1_8x32x1_1x32x1x8_8x8x1_1x1_intrawave_v3
304,16384,8192,1024,13,0,397.4913,a8w8_rowwise_256x128x128x128_32x32_2x2_8x32x1_8x32x1_1x32x1x8_8x8x1_1x1_intrawave_v3
304,16384,8192,2048,0,0,651.6743,a8w8_rowwise_256x256x256x64_32x32_4x4_4x64x1_4x64x1_1x32x1x8_8x8x1_1x1_intrawave_v4
304,16384,8192,3584,1,0,1009.2409,a8w8_rowwise_256x256x256x128_32x32_4x4_8x32x1_8x32x1_1x32x1x8_8x8x1_1x1_intrawave_v3
304,16384,8192,7168,1,0,1869.2019,a8w8_rowwise_256x256x256x128_32x32_4x4_8x32x1_8x32x1_1x32x1x8_8x8x1_1x1_intrawave_v3
304,16384,8192,8192,1,0,2088.7255,a8w8_rowwise_256x256x256x128_32x32_4x4_8x32x1_8x32x1_1x32x1x8_8x8x1_1x1_intrawave_v3
304,16384,8192,28672,39,0,7899.3949,a8w8_rowwise_256x224x256x128_16x16_7x8_8x32x1_8x32x1_1x32x1x8_8x8x1_1x2_intrawave_v3
304,16384,10240,8192,1,0,2627.738,a8w8_rowwise_256x256x256x128_32x32_4x4_8x32x1_8x32x1_1x32x1x8_8x8x1_1x1_intrawave_v3
304,16384,14336,8192,1,0,3709.1773,a8w8_rowwise_256x256x256x128_32x32_4x4_8x32x1_8x32x1_1x32x1x8_8x8x1_1x1_intrawave_v3
304,16384,57344,8192,40,0,14981.5462,a8w8_rowwise_256x256x224x128_16x16_8x7_8x32x1_8x32x1_1x64x1x4_8x8x1_2x1_intrawave_v3
304,1,2304,16384,34,0,28.8342,a8w8_rowwise_256x16x64x512_16x16_1x1_32x8x1_32x8x1_1x16x1x16_4x4x1_1x1_intrawave_v3
304,1,4608,16384,34,0,36.3172,a8w8_rowwise_256x16x64x512_16x16_1x1_32x8x1_32x8x1_1x16x1x16_4x4x1_1x1_intrawave_v3
304,1,9216,16384,34,0,53.1051,a8w8_rowwise_256x16x64x512_16x16_1x1_32x8x1_32x8x1_1x16x1x16_4x4x1_1x1_intrawave_v3
304,1,13312,16384,30,0,74.7731,a8w8_rowwise_256x32x64x512_16x16_1x2_32x8x1_32x8x1_1x32x1x8_8x8x1_1x2_intrawave_v3
304,1,16384,2048,77,0,12.968,a8w8_rowwise_64x16x16x64_16x16_1x1_4x16x1_4x16x1_1x16x1x4_4x4x1_1x1_interwave_v2
304,1,16384,4096,79,0,28.1967,a8w8_rowwise_128x16x32x128_16x16_1x1_8x16x1_8x16x1_1x16x1x8_4x4x1_1x1_interwave_v2
304,1,16384,6656,34,0,31.2399,a8w8_rowwise_256x16x64x512_16x16_1x1_32x8x1_32x8x1_1x16x1x16_4x4x1_1x1_intrawave_v3
304,1,16384,8192,60,0,50.8757,a8w8_rowwise_128x16x32x128_16x16_1x1_8x16x1_8x16x1_1x16x1x8_4x4x1_1x1_intrawave_v2
304,1,16384,13312,30,0,60.2,a8w8_rowwise_256x32x64x512_16x16_1x2_32x8x1_32x8x1_1x32x1x8_8x8x1_1x2_intrawave_v3
304,1,16384,26624,34,0,119.1666,a8w8_rowwise_256x16x64x512_16x16_1x1_32x8x1_32x8x1_1x16x1x16_4x4x1_1x1_intrawave_v3
304,1,26624,16384,78,0,129.4006,a8w8_rowwise_64x16x16x128_16x16_1x1_8x8x1_8x8x1_1x16x1x4_4x4x1_1x1_interwave_v2
304,1,53248,16384,61,0,247.2858,a8w8_rowwise_128x16x64x128_16x16_1x2_8x16x1_8x16x1_1x16x1x8_4x4x1_1x1_intrawave_v2
304,16,2304,16384,34,0,23.3002,a8w8_rowwise_256x16x64x512_16x16_1x1_32x8x1_32x8x1_1x16x1x16_4x4x1_1x1_intrawave_v3
304,16,4608,16384,34,0,30.8137,a8w8_rowwise_256x16x64x512_16x16_1x1_32x8x1_32x8x1_1x16x1x16_4x4x1_1x1_intrawave_v3
304,16,9216,16384,34,0,54.8776,a8w8_rowwise_256x16x64x512_16x16_1x1_32x8x1_32x8x1_1x16x1x16_4x4x1_1x1_intrawave_v3
304,16,13312,16384,34,0,73.2849,a8w8_rowwise_256x16x64x512_16x16_1x1_32x8x1_32x8x1_1x16x1x16_4x4x1_1x1_intrawave_v3
304,16,16384,2048,79,0,12.8107,a8w8_rowwise_128x16x32x128_16x16_1x1_8x16x1_8x16x1_1x16x1x8_4x4x1_1x1_interwave_v2
304,16,16384,4096,79,0,26.9895,a8w8_rowwise_128x16x32x128_16x16_1x1_8x16x1_8x16x1_1x16x1x8_4x4x1_1x1_interwave_v2
304,16,16384,6656,34,0,31.5283,a8w8_rowwise_256x16x64x512_16x16_1x1_32x8x1_32x8x1_1x16x1x16_4x4x1_1x1_intrawave_v3
304,16,16384,8192,78,0,50.1099,a8w8_rowwise_64x16x16x128_16x16_1x1_8x8x1_8x8x1_1x16x1x4_4x4x1_1x1_interwave_v2
304,16,16384,13312,34,0,59.3453,a8w8_rowwise_256x16x64x512_16x16_1x1_32x8x1_32x8x1_1x16x1x16_4x4x1_1x1_intrawave_v3
304,16,16384,26624,34,0,119.001,a8w8_rowwise_256x16x64x512_16x16_1x1_32x8x1_32x8x1_1x16x1x16_4x4x1_1x1_intrawave_v3
304,16,26624,16384,69,0,134.8674,a8w8_rowwise_128x16x32x128_16x16_1x1_8x16x1_8x16x1_1x16x1x8_4x4x1_1x1_interwave_v1
304,16,53248,16384,29,0,257.9722,a8w8_rowwise_256x32x96x256_16x16_1x3_16x16x1_16x16x1_1x32x1x8_4x4x1_1x1_intrawave_v3
304,32,2304,16384,34,0,23.937,a8w8_rowwise_256x16x64x512_16x16_1x1_32x8x1_32x8x1_1x16x1x16_4x4x1_1x1_intrawave_v3
304,32,4608,16384,34,0,32.2835,a8w8_rowwise_256x16x64x512_16x16_1x1_32x8x1_32x8x1_1x16x1x16_4x4x1_1x1_intrawave_v3
304,32,9216,16384,30,0,55.6098,a8w8_rowwise_256x32x64x512_16x16_1x2_32x8x1_32x8x1_1x32x1x8_8x8x1_1x2_intrawave_v3
304,32,13312,16384,30,0,76.1024,a8w8_rowwise_256x32x64x512_16x16_1x2_32x8x1_32x8x1_1x32x1x8_8x8x1_1x2_intrawave_v3
304,32,16384,2048,30,0,14.3388,a8w8_rowwise_256x32x64x512_16x16_1x2_32x8x1_32x8x1_1x32x1x8_8x8x1_1x2_intrawave_v3
304,32,16384,4096,34,0,29.9876,a8w8_rowwise_256x16x64x512_16x16_1x1_32x8x1_32x8x1_1x16x1x16_4x4x1_1x1_intrawave_v3
304,32,16384,6656,30,0,32.8485,a8w8_rowwise_256x32x64x512_16x16_1x2_32x8x1_32x8x1_1x32x1x8_8x8x1_1x2_intrawave_v3
304,32,16384,8192,30,0,57.5877,a8w8_rowwise_256x32x64x512_16x16_1x2_32x8x1_32x8x1_1x32x1x8_8x8x1_1x2_intrawave_v3
304,32,16384,13312,23,0,67.1081,a8w8_rowwise_256x64x64x512_32x32_1x1_32x8x1_32x8x1_1x32x1x8_8x8x1_1x1_intrawave_v3
304,32,16384,26624,30,0,125.3548,a8w8_rowwise_256x32x64x512_16x16_1x2_32x8x1_32x8x1_1x32x1x8_8x8x1_1x2_intrawave_v3
304,32,26624,16384,28,0,145.8065,a8w8_rowwise_256x32x128x256_32x32_1x1_16x16x1_16x16x1_1x32x1x8_8x8x1_1x1_intrawave_v3
304,32,53248,16384,29,0,268.7062,a8w8_rowwise_256x32x96x256_16x16_1x3_16x16x1_16x16x1_1x32x1x8_4x4x1_1x1_intrawave_v3
304,64,2304,16384,34,0,25.6306,a8w8_rowwise_256x16x64x512_16x16_1x1_32x8x1_32x8x1_1x16x1x16_4x4x1_1x1_intrawave_v3
304,64,4608,16384,30,0,38.6556,a8w8_rowwise_256x32x64x512_16x16_1x2_32x8x1_32x8x1_1x32x1x8_8x8x1_1x2_intrawave_v3
304,64,9216,16384,30,0,62.4413,a8w8_rowwise_256x32x64x512_16x16_1x2_32x8x1_32x8x1_1x32x1x8_8x8x1_1x2_intrawave_v3
304,64,13312,16384,23,0,95.3068,a8w8_rowwise_256x64x64x512_32x32_1x1_32x8x1_32x8x1_1x32x1x8_8x8x1_1x1_intrawave_v3
304,64,16384,2048,23,0,17.0095,a8w8_rowwise_256x64x64x512_32x32_1x1_32x8x1_32x8x1_1x32x1x8_8x8x1_1x1_intrawave_v3
304,64,16384,4096,30,0,34.1842,a8w8_rowwise_256x32x64x512_16x16_1x2_32x8x1_32x8x1_1x32x1x8_8x8x1_1x2_intrawave_v3
304,64,16384,6656,23,0,39.2547,a8w8_rowwise_256x64x64x512_32x32_1x1_32x8x1_32x8x1_1x32x1x8_8x8x1_1x1_intrawave_v3
304,64,16384,8192,28,0,62.1396,a8w8_rowwise_256x32x128x256_32x32_1x1_16x16x1_16x16x1_1x32x1x8_8x8x1_1x1_intrawave_v3
304,64,16384,13312,23,0,80.1585,a8w8_rowwise_256x64x64x512_32x32_1x1_32x8x1_32x8x1_1x32x1x8_8x8x1_1x1_intrawave_v3
304,64,16384,26624,23,0,160.3333,a8w8_rowwise_256x64x64x512_32x32_1x1_32x8x1_32x8x1_1x32x1x8_8x8x1_1x1_intrawave_v3
304,64,26624,16384,21,0,163.6357,a8w8_rowwise_256x64x128x256_32x32_1x2_16x16x1_16x16x1_1x32x1x8_8x8x1_1x1_intrawave_v3
304,64,53248,16384,18,0,289.8371,a8w8_rowwise_256x64x192x256_32x32_1x3_16x16x1_16x16x1_1x32x1x8_8x8x1_1x1_intrawave_v3
304,128,2304,16384,30,0,34.3268,a8w8_rowwise_256x32x64x512_16x16_1x2_32x8x1_32x8x1_1x32x1x8_8x8x1_1x2_intrawave_v3
304,128,4608,16384,30,0,50.9535,a8w8_rowwise_256x32x64x512_16x16_1x2_32x8x1_32x8x1_1x32x1x8_8x8x1_1x2_intrawave_v3
304,128,9216,16384,23,0,88.8034,a8w8_rowwise_256x64x64x512_32x32_1x1_32x8x1_32x8x1_1x32x1x8_8x8x1_1x1_intrawave_v3
304,128,13312,16384,21,0,127.8211,a8w8_rowwise_256x64x128x256_32x32_1x2_16x16x1_16x16x1_1x32x1x8_8x8x1_1x1_intrawave_v3
304,128,16384,2048,15,0,22.3431,a8w8_rowwise_256x128x64x256_32x32_2x1_16x16x1_16x16x1_1x32x1x8_8x8x1_1x1_intrawave_v3
304,128,16384,4096,21,0,41.8041,a8w8_rowwise_256x64x128x256_32x32_1x2_16x16x1_16x16x1_1x32x1x8_8x8x1_1x1_intrawave_v3
304,128,16384,6656,21,0,58.5876,a8w8_rowwise_256x64x128x256_32x32_1x2_16x16x1_16x16x1_1x32x1x8_8x8x1_1x1_intrawave_v3
304,128,16384,8192,14,0,81.2697,a8w8_rowwise_256x128x96x256_32x32_1x3_16x16x1_16x16x1_1x64x1x4_8x8x1_1x1_intrawave_v3
304,128,16384,13312,21,0,111.339,a8w8_rowwise_256x64x128x256_32x32_1x2_16x16x1_16x16x1_1x32x1x8_8x8x1_1x1_intrawave_v3
304,128,16384,26624,21,0,211.0414,a8w8_rowwise_256x64x128x256_32x32_1x2_16x16x1_16x16x1_1x32x1x8_8x8x1_1x1_intrawave_v3
304,128,26624,16384,18,0,209.8217,a8w8_rowwise_256x64x192x256_32x32_1x3_16x16x1_16x16x1_1x32x1x8_8x8x1_1x1_intrawave_v3
304,128,53248,16384,10,0,369.7714,a8w8_rowwise_256x128x192x128_32x32_2x3_8x32x1_8x32x1_1x32x1x8_8x8x1_1x1_intrawave_v3
304,256,2304,16384,30,0,47.4832,a8w8_rowwise_256x32x64x512_16x16_1x2_32x8x1_32x8x1_1x32x1x8_8x8x1_1x2_intrawave_v3
304,256,4608,16384,23,0,75.9463,a8w8_rowwise_256x64x64x512_32x32_1x1_32x8x1_32x8x1_1x32x1x8_8x8x1_1x1_intrawave_v3
304,256,9216,16384,21,0,131.2081,a8w8_rowwise_256x64x128x256_32x32_1x2_16x16x1_16x16x1_1x32x1x8_8x8x1_1x1_intrawave_v3
304,256,13312,16384,14,0,172.2679,a8w8_rowwise_256x128x96x256_32x32_1x3_16x16x1_16x16x1_1x64x1x4_8x8x1_1x1_intrawave_v3
304,256,16384,2048,12,0,31.9769,a8w8_rowwise_256x128x128x256_32x32_2x2_16x16x1_16x16x1_1x32x1x8_8x8x1_1x1_intrawave_v3
304,256,16384,4096,12,0,56.748,a8w8_rowwise_256x128x128x256_32x32_2x2_16x16x1_16x16x1_1x32x1x8_8x8x1_1x1_intrawave_v3
304,256,16384,6656,12,0,84.3868,a8w8_rowwise_256x128x128x256_32x32_2x2_16x16x1_16x16x1_1x32x1x8_8x8x1_1x1_intrawave_v3
304,256,16384,8192,12,0,103.5063,a8w8_rowwise_256x128x128x256_32x32_2x2_16x16x1_16x16x1_1x32x1x8_8x8x1_1x1_intrawave_v3
304,256,16384,13312,12,0,162.2378,a8w8_rowwise_256x128x128x256_32x32_2x2_16x16x1_16x16x1_1x32x1x8_8x8x1_1x1_intrawave_v3
304,256,16384,26624,12,0,321.9999,a8w8_rowwise_256x128x128x256_32x32_2x2_16x16x1_16x16x1_1x32x1x8_8x8x1_1x1_intrawave_v3
304,256,26624,16384,10,0,307.5373,a8w8_rowwise_256x128x192x128_32x32_2x3_8x32x1_8x32x1_1x32x1x8_8x8x1_1x1_intrawave_v3
304,256,53248,16384,3,0,560.9867,a8w8_rowwise_256x256x192x128_32x32_4x3_8x32x1_8x32x1_1x32x1x8_8x8x1_1x1_intrawave_v3
304,512,2304,16384,23,0,71.6957,a8w8_rowwise_256x64x64x512_32x32_1x1_32x8x1_32x8x1_1x32x1x8_8x8x1_1x1_intrawave_v3
304,512,4608,16384,15,0,123.0796,a8w8_rowwise_256x128x64x256_32x32_2x1_16x16x1_16x16x1_1x32x1x8_8x8x1_1x1_intrawave_v3
304,512,9216,16384,12,0,196.1399,a8w8_rowwise_256x128x128x256_32x32_2x2_16x16x1_16x16x1_1x32x1x8_8x8x1_1x1_intrawave_v3
304,512,13312,16384,10,0,277.4168,a8w8_rowwise_256x128x192x128_32x32_2x3_8x32x1_8x32x1_1x32x1x8_8x8x1_1x1_intrawave_v3
304,512,16384,2048,13,0,54.8349,a8w8_rowwise_256x128x128x128_32x32_2x2_8x32x1_8x32x1_1x32x1x8_8x8x1_1x1_intrawave_v3
304,512,16384,4096,9,0,96.5688,a8w8_rowwise_256x128x224x128_32x32_1x7_8x32x1_8x32x1_1x64x1x4_8x8x1_1x1_intrawave_v3
304,512,16384,6656,5,0,144.5329,a8w8_rowwise_256x256x128x128_32x32_4x2_8x32x1_8x32x1_1x32x1x8_8x8x1_1x1_intrawave_v3
304,512,16384,8192,8,0,176.3291,a8w8_rowwise_256x128x256x128_32x32_2x4_8x32x1_8x32x1_1x32x1x8_8x8x1_1x1_intrawave_v3
304,512,16384,13312,8,0,284.9853,a8w8_rowwise_256x128x256x128_32x32_2x4_8x32x1_8x32x1_1x32x1x8_8x8x1_1x1_intrawave_v3
304,512,16384,26624,8,0,559.535,a8w8_rowwise_256x128x256x128_32x32_2x4_8x32x1_8x32x1_1x32x1x8_8x8x1_1x1_intrawave_v3
304,512,26624,16384,2,0,523.2493,a8w8_rowwise_256x256x224x128_32x32_2x7_8x32x1_8x32x1_1x64x1x4_8x8x1_2x1_intrawave_v3
304,512,53248,16384,5,0,1050.3689,a8w8_rowwise_256x256x128x128_32x32_4x2_8x32x1_8x32x1_1x32x1x8_8x8x1_1x1_intrawave_v3
304,1024,2304,16384,15,0,123.5471,a8w8_rowwise_256x128x64x256_32x32_2x1_16x16x1_16x16x1_1x32x1x8_8x8x1_1x1_intrawave_v3
304,1024,4608,16384,12,0,187.1264,a8w8_rowwise_256x128x128x256_32x32_2x2_16x16x1_16x16x1_1x32x1x8_8x8x1_1x1_intrawave_v3
304,1024,9216,16384,5,0,350.0844,a8w8_rowwise_256x256x128x128_32x32_4x2_8x32x1_8x32x1_1x32x1x8_8x8x1_1x1_intrawave_v3
304,1024,13312,16384,2,0,500.9414,a8w8_rowwise_256x256x224x128_32x32_2x7_8x32x1_8x32x1_1x64x1x4_8x8x1_2x1_intrawave_v3
304,1024,16384,2048,1,0,94.4094,a8w8_rowwise_256x256x256x128_32x32_4x4_8x32x1_8x32x1_1x32x1x8_8x8x1_1x1_intrawave_v3
304,1024,16384,4096,40,0,165.8875,a8w8_rowwise_256x256x224x128_16x16_8x7_8x32x1_8x32x1_1x64x1x4_8x8x1_2x1_intrawave_v3
304,1024,16384,6656,1,0,245.5713,a8w8_rowwise_256x256x256x128_32x32_4x4_8x32x1_8x32x1_1x32x1x8_8x8x1_1x1_intrawave_v3
304,1024,16384,8192,40,0,305.3856,a8w8_rowwise_256x256x224x128_16x16_8x7_8x32x1_8x32x1_1x64x1x4_8x8x1_2x1_intrawave_v3
304,1024,16384,13312,1,0,468.4647,a8w8_rowwise_256x256x256x128_32x32_4x4_8x32x1_8x32x1_1x32x1x8_8x8x1_1x1_intrawave_v3
304,1024,16384,26624,1,0,888.5677,a8w8_rowwise_256x256x256x128_32x32_4x4_8x32x1_8x32x1_1x32x1x8_8x8x1_1x1_intrawave_v3
304,1024,26624,16384,3,0,970.0344,a8w8_rowwise_256x256x192x128_32x32_4x3_8x32x1_8x32x1_1x32x1x8_8x8x1_1x1_intrawave_v3
304,1024,53248,16384,5,0,1941.7791,a8w8_rowwise_256x256x128x128_32x32_4x2_8x32x1_8x32x1_1x32x1x8_8x8x1_1x1_intrawave_v3
304,2048,2304,16384,12,0,186.908,a8w8_rowwise_256x128x128x256_32x32_2x2_16x16x1_16x16x1_1x32x1x8_8x8x1_1x1_intrawave_v3
304,2048,4608,16384,8,0,340.8557,a8w8_rowwise_256x128x256x128_32x32_2x4_8x32x1_8x32x1_1x32x1x8_8x8x1_1x1_intrawave_v3
304,2048,9216,16384,1,0,593.9163,a8w8_rowwise_256x256x256x128_32x32_4x4_8x32x1_8x32x1_1x32x1x8_8x8x1_1x1_intrawave_v3
304,2048,13312,16384,3,0,934.3683,a8w8_rowwise_256x256x192x128_32x32_4x3_8x32x1_8x32x1_1x32x1x8_8x8x1_1x1_intrawave_v3
304,2048,16384,2048,40,0,179.9923,a8w8_rowwise_256x256x224x128_16x16_8x7_8x32x1_8x32x1_1x64x1x4_8x8x1_2x1_intrawave_v3
304,2048,16384,4096,1,0,313.2256,a8w8_rowwise_256x256x256x128_32x32_4x4_8x32x1_8x32x1_1x32x1x8_8x8x1_1x1_intrawave_v3
304,2048,16384,6656,2,0,481.5859,a8w8_rowwise_256x256x224x128_32x32_2x7_8x32x1_8x32x1_1x64x1x4_8x8x1_2x1_intrawave_v3
304,2048,16384,8192,40,0,577.2246,a8w8_rowwise_256x256x224x128_16x16_8x7_8x32x1_8x32x1_1x64x1x4_8x8x1_2x1_intrawave_v3
304,2048,16384,13312,1,0,925.4789,a8w8_rowwise_256x256x256x128_32x32_4x4_8x32x1_8x32x1_1x32x1x8_8x8x1_1x1_intrawave_v3
304,2048,16384,26624,1,0,1769.157,a8w8_rowwise_256x256x256x128_32x32_4x4_8x32x1_8x32x1_1x32x1x8_8x8x1_1x1_intrawave_v3
304,2048,26624,16384,1,0,1721.0223,a8w8_rowwise_256x256x256x128_32x32_4x4_8x32x1_8x32x1_1x32x1x8_8x8x1_1x1_intrawave_v3
304,2048,53248,16384,3,0,3694.8838,a8w8_rowwise_256x256x192x128_32x32_4x3_8x32x1_8x32x1_1x32x1x8_8x8x1_1x1_intrawave_v3
304,4096,2304,16384,8,0,342.2706,a8w8_rowwise_256x128x256x128_32x32_2x4_8x32x1_8x32x1_1x32x1x8_8x8x1_1x1_intrawave_v3
304,4096,4608,16384,1,0,587.0924,a8w8_rowwise_256x256x256x128_32x32_4x4_8x32x1_8x32x1_1x32x1x8_8x8x1_1x1_intrawave_v3
304,4096,9216,16384,1,0,1225.7115,a8w8_rowwise_256x256x256x128_32x32_4x4_8x32x1_8x32x1_1x32x1x8_8x8x1_1x1_intrawave_v3
304,4096,13312,16384,1,0,1811.2412,a8w8_rowwise_256x256x256x128_32x32_4x4_8x32x1_8x32x1_1x32x1x8_8x8x1_1x1_intrawave_v3
304,4096,16384,2048,39,0,342.6491,a8w8_rowwise_256x224x256x128_16x16_7x8_8x32x1_8x32x1_1x32x1x8_8x8x1_1x2_intrawave_v3
304,4096,16384,4096,2,0,604.181,a8w8_rowwise_256x256x224x128_32x32_2x7_8x32x1_8x32x1_1x64x1x4_8x8x1_2x1_intrawave_v3
304,4096,16384,6656,39,0,935.9307,a8w8_rowwise_256x224x256x128_16x16_7x8_8x32x1_8x32x1_1x32x1x8_8x8x1_1x2_intrawave_v3
304,4096,16384,8192,1,0,1123.8171,a8w8_rowwise_256x256x256x128_32x32_4x4_8x32x1_8x32x1_1x32x1x8_8x8x1_1x1_intrawave_v3
304,4096,16384,13312,1,0,1759.787,a8w8_rowwise_256x256x256x128_32x32_4x4_8x32x1_8x32x1_1x32x1x8_8x8x1_1x1_intrawave_v3
304,4096,16384,26624,40,0,3572.8129,a8w8_rowwise_256x256x224x128_16x16_8x7_8x32x1_8x32x1_1x64x1x4_8x8x1_2x1_intrawave_v3
304,4096,26624,16384,5,0,3650.6996,a8w8_rowwise_256x256x128x128_32x32_4x2_8x32x1_8x32x1_1x32x1x8_8x8x1_1x1_intrawave_v3
304,4096,53248,16384,1,0,6584.1754,a8w8_rowwise_256x256x256x128_32x32_4x4_8x32x1_8x32x1_1x32x1x8_8x8x1_1x1_intrawave_v3
304,8192,2304,16384,1,0,605.1023,a8w8_rowwise_256x256x256x128_32x32_4x4_8x32x1_8x32x1_1x32x1x8_8x8x1_1x1_intrawave_v3
304,8192,4608,16384,1,0,1159.5237,a8w8_rowwise_256x256x256x128_32x32_4x4_8x32x1_8x32x1_1x32x1x8_8x8x1_1x1_intrawave_v3
304,8192,9216,16384,1,0,2322.8467,a8w8_rowwise_256x256x256x128_32x32_4x4_8x32x1_8x32x1_1x32x1x8_8x8x1_1x1_intrawave_v3
304,8192,13312,16384,1,0,3422.6811,a8w8_rowwise_256x256x256x128_32x32_4x4_8x32x1_8x32x1_1x32x1x8_8x8x1_1x1_intrawave_v3
304,8192,16384,2048,1,0,640.4243,a8w8_rowwise_256x256x256x128_32x32_4x4_8x32x1_8x32x1_1x32x1x8_8x8x1_1x1_intrawave_v3
304,8192,16384,4096,1,0,1118.9804,a8w8_rowwise_256x256x256x128_32x32_4x4_8x32x1_8x32x1_1x32x1x8_8x8x1_1x1_intrawave_v3
304,8192,16384,6656,1,0,1721.0306,a8w8_rowwise_256x256x256x128_32x32_4x4_8x32x1_8x32x1_1x32x1x8_8x8x1_1x1_intrawave_v3
304,8192,16384,8192,1,0,2120.8768,a8w8_rowwise_256x256x256x128_32x32_4x4_8x32x1_8x32x1_1x32x1x8_8x8x1_1x1_intrawave_v3
304,8192,16384,13312,0,0,3520.1868,a8w8_rowwise_256x256x256x64_32x32_4x4_4x64x1_4x64x1_1x32x1x8_8x8x1_1x1_intrawave_v4
304,8192,16384,26624,1,0,6937.4353,a8w8_rowwise_256x256x256x128_32x32_4x4_8x32x1_8x32x1_1x32x1x8_8x8x1_1x1_intrawave_v3
304,8192,26624,16384,1,0,6777.3956,a8w8_rowwise_256x256x256x128_32x32_4x4_8x32x1_8x32x1_1x32x1x8_8x8x1_1x1_intrawave_v3
304,8192,53248,16384,1,0,13916.9205,a8w8_rowwise_256x256x256x128_32x32_4x4_8x32x1_8x32x1_1x32x1x8_8x8x1_1x1_intrawave_v3
304,16384,2304,16384,1,0,1194.6459,a8w8_rowwise_256x256x256x128_32x32_4x4_8x32x1_8x32x1_1x32x1x8_8x8x1_1x1_intrawave_v3
304,16384,4608,16384,1,0,2387.8435,a8w8_rowwise_256x256x256x128_32x32_4x4_8x32x1_8x32x1_1x32x1x8_8x8x1_1x1_intrawave_v3
304,16384,9216,16384,1,0,4858.7189,a8w8_rowwise_256x256x256x128_32x32_4x4_8x32x1_8x32x1_1x32x1x8_8x8x1_1x1_intrawave_v3
304,16384,13312,16384,1,0,6719.3036,a8w8_rowwise_256x256x256x128_32x32_4x4_8x32x1_8x32x1_1x32x1x8_8x8x1_1x1_intrawave_v3
304,16384,16384,2048,1,0,1255.2745,a8w8_rowwise_256x256x256x128_32x32_4x4_8x32x1_8x32x1_1x32x1x8_8x8x1_1x1_intrawave_v3
304,16384,16384,4096,1,0,2246.9404,a8w8_rowwise_256x256x256x128_32x32_4x4_8x32x1_8x32x1_1x32x1x8_8x8x1_1x1_intrawave_v3
304,16384,16384,6656,1,0,3511.0559,a8w8_rowwise_256x256x256x128_32x32_4x4_8x32x1_8x32x1_1x32x1x8_8x8x1_1x1_intrawave_v3
304,16384,16384,8192,1,0,4304.1219,a8w8_rowwise_256x256x256x128_32x32_4x4_8x32x1_8x32x1_1x32x1x8_8x8x1_1x1_intrawave_v3
304,16384,16384,13312,1,0,6945.8747,a8w8_rowwise_256x256x256x128_32x32_4x4_8x32x1_8x32x1_1x32x1x8_8x8x1_1x1_intrawave_v3
304,16384,16384,26624,1,0,13701.845,a8w8_rowwise_256x256x256x128_32x32_4x4_8x32x1_8x32x1_1x32x1x8_8x8x1_1x1_intrawave_v3
304,16384,26624,16384,3,0,14192.1692,a8w8_rowwise_256x256x192x128_32x32_4x3_8x32x1_8x32x1_1x32x1x8_8x8x1_1x1_intrawave_v3
304,16384,53248,16384,1,0,29458.5146,a8w8_rowwise_256x256x256x128_32x32_4x4_8x32x1_8x32x1_1x32x1x8_8x8x1_1x1_intrawave_v3
